ELECAUDITSID,ID,AUDITYEAR,DBKEY,CFDASEQNUM,CFDA,FEDERALPROGRAMNAME,AMOUNT,MAJORPROGRAM,TYPEREQUIREMENT,QCOSTS2,FINDINGS,FINDINGREFNUMS,RD,DIRECT,CFDA_PREFIX,CFDA_EXT,EIN,CFDA2,TYPEREPORT_MP,TYPEREPORT_MP_OVERRIDE,ARRA,LOANS,FINDINGSCOUNT,LOANBALANCE,PASSTHROUGHAMOUNT,AWARDIDENTIFICATION,CLUSTERNAME,PASSTHROUGHAWARD,STATECLUSTERNAME,PROGRAMTOTAL,CLUSTERTOTAL,OTHERCLUSTERNAME,CFDAPROGRAMNAME
30219966,1466322018309,2018,146632,309,16.838,COMPREHENSIVE OPIOID ABUSE SITE-BASED PROGRAM,22732,N,,,,,,Y,16,838,726000720,16,,,,N,0,,0,,,N,,22732,,,
30219688,146632201831,2018,146632,31,10.614,SCIENTIFIC COOPERATION EXCHANGE PROGRAM WITH CHINA,24087,N,,,,,,Y,10,614,726000720,10,,,,N,0,,0,,,N,,24087,,,
30219967,1466322018310,2018,146632,310,16.922,EQUITABLE SHARING PROGRAM,28196,N,,,,,,Y,16,922,726000720,16,,,,N,0,,0,,,N,,28196,,,
30219968,1466322018311,2018,146632,311,16.U04,ASSET FORFEITURE,37391,N,,,,,,Y,16,U04,726000720,16,,,,N,0,,0,ASSET FORFEITURE,,N,,37391,,,
30219969,1466322018312,2018,146632,312,16.U05,FBI.GOV,19176,N,,,,,,Y,16,U05,726000720,16,,,,N,0,,0,DJF-14-1200-P-0002242,,N,,19176,,,
30219970,1466322018313,2018,146632,313,16.U06,LEEP (LEO) PHASE XXI,639651,N,,,,,,Y,16,U06,726000720,16,,,,N,0,,0,DJF-15-1200-A-0010901,,N,,639651,,,
30219971,1466322018314,2018,146632,314,16.U07,INFRAGARD,725410,N,,,,,,Y,16,U07,726000720,16,,,,N,0,,0,DJF-15-1200-P-0000332,,N,,725410,,,
30219972,1466322018315,2018,146632,315,16.U08,FBI.GOV YEAR 10,102794,N,,,,,,Y,16,U08,726000720,16,,,,N,0,,0,DJF-17-1200-P-0002338,,N,,102794,,,
30219973,1466322018316,2018,146632,316,16.U09,LEO PHASE XXIII,5614983,N,,,,,,Y,16,U09,726000720,16,,,,N,0,,0,DJF-17-1200-P-0002601,,N,,5614983,,,
30219974,1466322018317,2018,146632,317,16.U10,COURT COSTS AND FEES COLLECTION PROGRAM,15585,N,,,,,,N,16,U10,726000720,16,,,,N,0,,0,SJIT009.018,,N,,15585,,,
30219975,1466322018318,2018,146632,318,16.560,"NATIONAL INSTITUTE OF JUSTICE RESEARCH, EVALUATION, AND DEVELOPMENT PROJECT GRANTS",85685,Y,,,,,,N,16,560,726000720,16,Q,,,N,3,,0,,RESEARCH AND DEVELOPMENT,N,,85685,165625245,,
30219976,1466322018319,2018,146632,319,16.726,JUVENILE MENTORING PROGRAM,171655,Y,,,,,,N,16,726,726000720,16,Q,,,N,3,,0,,RESEARCH AND DEVELOPMENT,N,,239544,165625245,,
30219689,146632201832,2018,146632,32,10.664,COOPERATIVE FORESTRY ASSISTANCE,2296278,N,,,,,,Y,10,664,726000720,10,,,,N,0,,0,,,N,,2364870,,,
30219977,1466322018320,2018,146632,320,17.002,LABOR FORCE STATISTICS,1037507,N,,,,,,Y,17,002,726000720,17,,,,N,0,,0,,,N,,1037507,,,
30219978,1466322018321,2018,146632,321,17.005,COMPENSATION AND WORKING CONDITIONS,118746,N,,,,,,Y,17,005,726000720,17,,,,N,0,,0,,,N,,118746,,,
30219979,1466322018322,2018,146632,322,17.225,UNEMPLOYMENT INSURANCE,211785446,Y,,,,,,Y,17,225,726000720,17,U,,,N,2,,0,,,N,,211785446,,,
30219980,1466322018323,2018,146632,323,17.235,SENIOR COMMUNITY SERVICE EMPLOYMENT PROGRAM,1317059,N,,,,,,Y,17,235,726000720,17,,,,N,0,,1276986,,,Y,,1317059,,,
30219984,1466322018327,2018,146632,327,17.273,TEMPORARY LABOR CERTIFICATION FOR FOREIGN WORKERS,182589,N,,,,,,Y,17,273,726000720,17,,,,N,0,,0,,,N,,182589,,,
30219981,1466322018324,2018,146632,324,17.245,TRADE ADJUSTMENT ASSISTANCE,712728,N,,,,,,Y,17,245,726000720,17,,,,N,0,,0,,,N,,712728,,,
30219982,1466322018325,2018,146632,325,17.255,WORKFORCE INNOVATION AND OPPORTUNITY ACT,84137,N,,,,,,Y,17,255,726000720,17,,,,N,0,,0,,,N,,84137,,,
30219983,1466322018326,2018,146632,326,17.271,WORK OPPORTUNITY TAX CREDIT PROGRAM (WOTC),309807,N,,,,,,Y,17,271,726000720,17,,,,N,0,,0,,,N,,309807,,,
30219985,1466322018328,2018,146632,328,17.274,YOUTHBUILD,833790,N,,,,,,Y,17,274,726000720,17,,,,N,0,,0,,,N,,833790,,,
30219986,1466322018329,2018,146632,329,17.277,WORKFORCE INVESTMENT ACT (WIA) NATIONAL EMERGENCY GRANTS,803061,N,,,,,,Y,17,277,726000720,17,,,,N,0,,203247,,,Y,,803061,,,
30219690,146632201833,2018,146632,33,10.675,URBAN AND COMMUNITY FORESTRY PROGRAM,19467,N,,,,,,Y,10,675,726000720,10,,,,N,0,,0,,,N,,19467,,,
30219987,1466322018330,2018,146632,330,17.281,WORKFORCE INVESTMENT ACT (WIA) DISLOCATED WORKER NATIONAL RESERVE TECHNICAL ASSISTANCE AND TRAINING,7751,N,,,,,,Y,17,281,726000720,17,,,,N,0,,0,,,N,,7751,,,
30219988,1466322018331,2018,146632,331,17.282,TRADE ADJUSTMENT ASSISTANCE COMMUNITY COLLEGE AND CAREER TRAINING (TAACCCT) GRANTS,1505949,N,,,,,,Y,17,282,726000720,17,,,,N,0,,0,,,N,,1941388,,,
30219989,1466322018332,2018,146632,332,17.282,TRADE ADJUSTMENT ASSISTANCE COMMUNITY COLLEGE AND CAREER TRAINING (TAACCCT) GRANTS,435439,N,,,,,,N,17,282,726000720,17,,,,N,0,,0,,,N,,1941388,,,
30219990,1466322018333,2018,146632,333,17.285,APPRENTICESHIP USA GRANTS,269847,N,,,,,,Y,17,285,726000720,17,,,,N,0,,0,,,N,,269847,,,
30219991,1466322018334,2018,146632,334,17.504,CONSULTATION AGREEMENTS,806440,N,,,,,,Y,17,504,726000720,17,,,,N,0,,0,,,N,,806440,,,
30219992,1466322018335,2018,146632,335,17.602,MINE HEALTH AND SAFETY EDUCATION AND TRAINING,107120,N,,,,,,Y,17,602,726000720,17,,,,N,0,,0,,,N,,107120,,,
30219993,1466322018336,2018,146632,336,17.207,EMPLOYMENT SERVICE/WAGNER-PEYSER FUNDED ACTIVITIES,7650871,N,,,,,,Y,17,207,726000720,17,,,,N,0,,0,,EMPLOYMENT SERVICE CLUSTER,N,,7650871,10183804,,
30219994,1466322018337,2018,146632,337,17.801,DISABLED VETERANS' OUTREACH PROGRAM (DVOP),2532933,N,,,,,,Y,17,801,726000720,17,,,,N,0,,0,,EMPLOYMENT SERVICE CLUSTER,N,,2532933,10183804,,
30219995,1466322018338,2018,146632,338,17.258,WIA ADULT PROGRAM,13133455,N,,,,,,Y,17,258,726000720,17,,,,N,0,,10419832,,WIA CLUSTER,Y,,13133455,37780617,,
30219996,1466322018339,2018,146632,339,17.259,WIA YOUTH ACTIVITIES,12046428,N,,,,,,Y,17,259,726000720,17,,,,N,0,,9685563,,WIA CLUSTER,Y,,12102179,37780617,,
30219691,146632201834,2018,146632,34,10.691,GOOD NEIGHBOR AUTHORITY,16669,N,,,,,,Y,10,691,726000720,10,,,,N,0,,0,,,N,,16669,,,
30219997,1466322018340,2018,146632,340,17.259,WIA YOUTH ACTIVITIES,55751,N,,,,,,N,17,259,726000720,17,,,,N,0,,0,,WIA CLUSTER,N,,12102179,37780617,,
30219998,1466322018341,2018,146632,341,17.278,WIA DISLOCATED WORKER FORMULA GRANTS,12544983,N,,,,,,Y,17,278,726000720,17,,,,N,0,,8864774,,WIA CLUSTER,Y,,12544983,37780617,,
30219999,1466322018342,2018,146632,342,19.033,GLOBAL THREAT REDUCTION,1964999,N,,,,,,Y,19,033,726000720,19,,,,N,0,,0,,,N,,2118538,,,
30220000,1466322018343,2018,146632,343,19.033,GLOBAL THREAT REDUCTION,153539,N,,,,,,N,19,033,726000720,19,,,,N,0,,0,,,N,,2118538,,,
30220001,1466322018344,2018,146632,344,19.700,GENERAL DEPARTMENT OF STATE ASSISTANCE,95,N,,,,,,N,19,700,726000720,19,,,,N,0,,0,,,N,,95,,,
30220002,1466322018345,2018,146632,345,20.106,AIRPORT IMPROVEMENT PROGRAM,609128,N,,,,,,Y,20,106,726000720,20,,,,N,0,,0,,,N,,609128,,,
30220003,1466322018346,2018,146632,346,20.215,HIGHWAY TRAINING AND EDUCATION,33236,N,,,,,,Y,20,215,726000720,20,,,,N,0,,0,,,N,,40742,,,
30220004,1466322018347,2018,146632,347,20.218,NATIONAL MOTOR CARRIER SAFETY,4359462,N,,,,,,Y,20,218,726000720,20,,,,N,0,,0,,,N,,4359462,,,
30220005,1466322018348,2018,146632,348,20.232,COMMERCIAL DRIVER'S LICENSE PROGRAM IMPROVEMENT GRANT,1154125,N,,,,,,Y,20,232,726000720,20,,,,N,0,,0,,,N,,1154125,,,
30220006,1466322018349,2018,146632,349,20.234,SAFETY DATA IMPROVEMENT PROGRAM,55142,N,,,,,,Y,20,234,726000720,20,,,,N,0,,0,,,N,,55142,,,
30219692,146632201835,2018,146632,35,10.777,NORMAN E. BORLAUG INTERNATIONAL AGRICULTURAL SCIENCE AND TECHNOLOGY FELLOWSHIP,162371,N,,,,,,Y,10,777,726000720,10,,,,N,0,,0,,,N,,162371,,,
30220007,1466322018350,2018,146632,350,20.237,COMMERCIAL VEHICLE INFORMATION SYSTEMS AND NETWORKS,117506,N,,,,,,Y,20,237,726000720,20,,,,N,0,,0,,,N,,117506,,,
30220008,1466322018351,2018,146632,351,20.505,METROPOLITAN TRANSPORTATION PLANNING AND STATE AND NON-METROPOLITAN PLANNING AND RESEARCH,1033739,N,,,,,,Y,20,505,726000720,20,,,,N,0,,934480,,,Y,,1033739,,,
30220009,1466322018352,2018,146632,352,20.509,FORMULA GRANTS FOR RURAL AREAS,9430971,N,,,,,,Y,20,509,726000720,20,,,,N,0,,6346397,,,Y,,9430971,,,
30220010,1466322018353,2018,146632,353,20.528,RAIL FIXED GUIDEWAY PUBLIC TRANSPORTATION SYSTEM STATE SAFETY OVERSIGHT FORMULA GRANT PROGRAM,210501,N,,,,,,Y,20,528,726000720,20,,,,N,0,,0,,,N,,210501,,,
30220011,1466322018354,2018,146632,354,20.607,ALCOHOL OPEN CONTAINER REQUIREMENTS,2422605,N,,,,,,Y,20,607,726000720,20,,,,N,1,,1161853,,,Y,,2435251,,,
30220012,1466322018355,2018,146632,355,20.608,MINIMUM PENALTIES FOR REPEAT OFFENDERS FOR DRIVING WHILE INTOXICATED,3684082,N,,,,,,Y,20,608,726000720,20,,,,N,1,,2126820,,,Y,,3684082,,,
30220013,1466322018356,2018,146632,356,20.700,PIPELINE SAFETY PROGRAM STATE BASE GRANT,1568641,N,,,,,,Y,20,700,726000720,20,,,,N,0,,0,,,N,,1568641,,,
30220014,1466322018357,2018,146632,357,20.703,INTERAGENCY HAZARDOUS MATERIALS PUBLIC SECTOR TRAINING AND PLANNING GRANTS,524942,N,,,,,,Y,20,703,726000720,20,,,,N,0,,0,,,N,,524942,,,
30220015,1466322018358,2018,146632,358,20.710,TECHNICAL ASSISTANCE GRANTS,27198,N,,,,,,Y,20,710,726000720,20,,,,N,0,,0,,,N,,27198,,,
30220016,1466322018359,2018,146632,359,20.720,STATE DAMAGE PREVENTION PROGRAM GRANTS,19265,N,,,,,,Y,20,720,726000720,20,,,,N,0,,0,,,N,,19265,,,
30219693,146632201836,2018,146632,36,10.874,DELTA HEALTH CARE SERVICES GRANT PROGRAM,26581,N,,,,,,Y,10,874,726000720,10,,,,N,0,,0,,,N,,272491,,,
30220017,1466322018360,2018,146632,360,20.721,PHMSA PIPELINE SAFETY PROGRAM ONE CALL GRANT,40416,N,,,,,,Y,20,721,726000720,20,,,,N,0,,0,,,N,,40416,,,
30220018,1466322018361,2018,146632,361,20.933,NATIONAL INFRASTRUCTURE INVESTMENTS,177433,N,,,,,,Y,20,933,726000720,20,,,,N,0,,38643,,,Y,,177433,,,
30220019,1466322018362,2018,146632,362,20.U01,LA FISHERIES FORWARD 2018 SUMMIT (BTNEP SUPPORT),5000,N,,,,,,N,20,U01,726000720,20,,,,N,0,,0,LFFS,,N,,5000,,,
30220020,1466322018363,2018,146632,363,20.200,HIGHWAY RESEARCH AND DEVELOPMENT PROGRAM,3000,Y,,,,,,N,20,200,726000720,20,Q,,,N,3,,0,,RESEARCH AND DEVELOPMENT,N,,3000,165625245,,
30220024,1466322018367,2018,146632,367,20.RD,"AASHTO PARTNERSHIP HANDBOOK, SECOND EDITION",-18944,Y,,,,,,N,20,RD,726000720,20,Q,,,N,3,,0,428-17-10A,RESEARCH AND DEVELOPMENT,N,,-16132,165625245,,
30220021,1466322018364,2018,146632,364,20.205,HIGHWAY PLANNING AND CONSTRUCTION,62995,Y,,,,,,N,20,205,726000720,20,Q,,,N,3,,30712,,RESEARCH AND DEVELOPMENT,Y,,701342334,165625245,,
30220022,1466322018365,2018,146632,365,20.215,HIGHWAY TRAINING AND EDUCATION,7506,Y,,,,,,Y,20,215,726000720,20,Q,,,N,3,,0,,RESEARCH AND DEVELOPMENT,N,,40742,165625245,,
30220023,1466322018366,2018,146632,366,20.314,RAILROAD DEVELOPMENT,14999,Y,,,,,,N,20,314,726000720,20,Q,,,N,3,,0,,RESEARCH AND DEVELOPMENT,N,,14999,165625245,,
30220025,1466322018368,2018,146632,368,20.514,PUBLIC TRANSPORTATION RESEARCH,78220,Y,,,,,,N,20,514,726000720,20,Q,,,N,3,,0,,RESEARCH AND DEVELOPMENT,N,,78220,165625245,,
30220026,1466322018369,2018,146632,369,20.607,ALCOHOL OPEN CONTAINER REQUIREMENTS,12646,Y,,,,,,N,20,607,726000720,20,Q,,,N,3,,0,,RESEARCH AND DEVELOPMENT,N,,2435251,165625245,,
30219694,146632201837,2018,146632,37,10.890,RURAL DEVELOPMENT COOPERATIVE AGREEMENT PROGRAM,-3142,N,,,,,,N,10,890,726000720,10,,,,N,0,,0,,,N,,5956,,,
30220027,1466322018370,2018,146632,370,20.614,NATIONAL HIGHWAY TRAFFIC SAFETY ADMINISTRATION (NHTSA) DISCRETIONARY SAFETY GRANTS,51175,Y,,,,,,Y,20,614,726000720,20,Q,,,N,3,,0,,RESEARCH AND DEVELOPMENT,N,,51175,165625245,,
30220028,1466322018371,2018,146632,371,20.701,UNIVERSITY TRANSPORTATION CENTERS PROGRAM,1530806,Y,,,,,,Y,20,701,726000720,20,Q,,,N,3,,925815,,RESEARCH AND DEVELOPMENT,Y,,2297378,165625245,,
30220029,1466322018372,2018,146632,372,20.701,UNIVERSITY TRANSPORTATION CENTERS PROGRAM,766572,Y,,,,,,N,20,701,726000720,20,Q,,,N,3,,6350,,RESEARCH AND DEVELOPMENT,Y,,2297378,165625245,,
30220030,1466322018373,2018,146632,373,20.RD,ROBOTIC UTILITY MAPPING,2812,Y,,,,,,N,20,RD,726000720,20,Q,,,N,3,,0,DTRT5714C10037,RESEARCH AND DEVELOPMENT,N,,-16132,165625245,,
30220031,1466322018374,2018,146632,374,20.526,BUS AND BUS FACILITIES FORMULA PROGRAM,2139530,N,,,,,,Y,20,526,726000720,20,,,,N,0,,0,,FEDERAL TRANSIT CLUSTER,N,,2139530,2139530,,
30220032,1466322018375,2018,146632,375,20.205,HIGHWAY PLANNING AND CONSTRUCTION,701279339,N,,,,,,Y,20,205,726000720,20,,,,N,0,,59735354,,HIGHWAY PLANNING AND CONSTRUCTION CLUSTER,Y,,701342334,703503998,,
30220033,1466322018376,2018,146632,376,20.219,RECREATIONAL TRAILS PROGRAM,2224659,N,,,,,,Y,20,219,726000720,20,,,,N,0,,1844836,,HIGHWAY PLANNING AND CONSTRUCTION CLUSTER,Y,,2224659,703503998,,
30220034,1466322018377,2018,146632,377,20.600,STATE AND COMMUNITY HIGHWAY SAFETY,4032598,Y,,,,,,Y,20,600,726000720,20,U,,,N,4,,2645277,,HIGHWAY SAFETY CLUSTER,Y,,4032598,6518196,,
30220035,1466322018378,2018,146632,378,20.610,STATE TRAFFIC SAFETY INFORMATION SYSTEM IMPROVEMENT GRANTS,448273,Y,,,,,,Y,20,610,726000720,20,U,,,N,3,,0,,HIGHWAY SAFETY CLUSTER,N,,448273,6518196,,
30220036,1466322018379,2018,146632,379,20.616,NATIONAL PRIORITY SAFETY PROGRAMS,2037325,Y,,,,,,Y,20,616,726000720,20,U,,,N,4,,635485,,HIGHWAY SAFETY CLUSTER,Y,,2037325,6518196,,
30219695,146632201838,2018,146632,38,10.902,SOIL AND WATER CONSERVATION,95900,N,,,,,,Y,10,902,726000720,10,,,,N,0,,0,,,N,,129916,,,
30220037,1466322018380,2018,146632,380,20.513,ENHANCED MOBILITY OF SENIORS AND INDIVIDUALS WITH DISABILITIES,5150670,N,,,,,,Y,20,513,726000720,20,,,,N,0,,1561139,,TRANSIT SERVICES PROGRAMS CLUSTER,Y,,5150670,5519001,,
30220038,1466322018381,2018,146632,381,20.516,JOB ACCESS AND REVERSE COMMUTE PROGRAM,242642,N,,,,,,Y,20,516,726000720,20,,,,N,0,,215917,,TRANSIT SERVICES PROGRAMS CLUSTER,Y,,242642,5519001,,
30220039,1466322018382,2018,146632,382,20.521,NEW FREEDOM PROGRAM,125689,N,,,,,,Y,20,521,726000720,20,,,,N,0,,125689,,TRANSIT SERVICES PROGRAMS CLUSTER,Y,,125689,5519001,,
30220040,1466322018383,2018,146632,383,21.015,"RESOURCES AND ECOSYSTEMS SUSTAINABILITY, TOURIST OPPORTUNITIES, AND REVIVED ECONOMIES OF THE GULF COAST STATES",3659691,N,,,,,,Y,21,015,726000720,21,,,,N,0,,466243,,,Y,,4104741,,,
30220041,1466322018384,2018,146632,384,21.015,"RESOURCES AND ECOSYSTEMS SUSTAINABILITY, TOURIST OPPORTUNITIES, AND REVIVED ECONOMIES OF THE GULF COAST STATES",445050,Y,,,,,,N,21,015,726000720,21,Q,,,N,3,,7809,,RESEARCH AND DEVELOPMENT,Y,,4104741,165625245,,
30220042,1466322018385,2018,146632,385,27.011,INTERGOVERNMENTAL PERSONNEL ACT (IPA) MOBILITY PROGRAM,40220,Y,,,,,,Y,27,011,726000720,27,Q,,,N,3,,0,,RESEARCH AND DEVELOPMENT,N,,40220,165625245,,
30220043,1466322018386,2018,146632,386,30.001,EMPLOYMENT DISCRIMINATION_TITLE VII OF THE CIVIL RIGHTS ACT OF 1964,356572,N,,,,,,Y,30,001,726000720,30,,,,N,0,,0,,,N,,356572,,,
30220044,1466322018387,2018,146632,387,39.003,DONATION OF FEDERAL SURPLUS PERSONAL PROPERTY,3953172,N,,,,,,Y,39,003,726000720,39,,,,N,0,,0,,,N,,3953172,,,
30220045,1466322018388,2018,146632,388,42.U01,TEACHING WITH PRIMARY SOURCES,36657,N,,,,,,Y,42,U01,726000720,42,,,,N,0,,0,GA08C0022,,N,,36657,,,
30220046,1466322018389,2018,146632,389,43.008,EDUCATION,32642,N,,,,,,Y,43,008,726000720,43,,,,N,0,,0,,,N,,1556904,,,
30219696,146632201839,2018,146632,39,10.912,ENVIRONMENTAL QUALITY INCENTIVES PROGRAM,1012721,N,,,,,,Y,10,912,726000720,10,,,,N,0,,0,,,N,,1652266,,,
30220047,1466322018390,2018,146632,390,43.001,SCIENCE,411260,Y,,,,,,Y,43,001,726000720,43,Q,,,N,3,,0,,RESEARCH AND DEVELOPMENT,N,,532524,165625245,,
30220048,1466322018391,2018,146632,391,43.001,SCIENCE,121264,Y,,,,,,N,43,001,726000720,43,Q,,,N,3,,0,,RESEARCH AND DEVELOPMENT,N,,532524,165625245,,
30220049,1466322018392,2018,146632,392,43.003,EXPLORATION,153804,Y,,,,,,Y,43,003,726000720,43,Q,,,N,3,,15912,,RESEARCH AND DEVELOPMENT,Y,,153804,165625245,,
30220050,1466322018393,2018,146632,393,43.008,EDUCATION,1524262,Y,,,,,,Y,43,008,726000720,43,Q,,,N,5,,22621,,RESEARCH AND DEVELOPMENT,Y,,1556904,165625245,,
30220051,1466322018394,2018,146632,394,43.RD,"FLOW OF WATER, CARBON, AND SEDIMENT WITHIN THE LAND-SEA CONTINUUM",2403,Y,,,,,,N,43,RD,726000720,43,Q,,,N,3,,0,1565803,RESEARCH AND DEVELOPMENT,N,,766068,165625245,,
30220052,1466322018395,2018,146632,395,43.RD,LATE-TIME UV SPECTROSCOPIC SIGNATURES FROM CIRCUMSTELLAR INTERACTION IN TYPE I,1229,Y,,,,,,N,43,RD,726000720,43,Q,,,N,3,,0,HST-GO-13287-005-A,RESEARCH AND DEVELOPMENT,N,,766068,165625245,,
30220053,1466322018396,2018,146632,396,43.RD,LEGUS: LEGACY EXTRAGALACTIC UV SURVEY,842,Y,,,,,,N,43,RD,726000720,43,Q,,,N,3,,0,HST-GO-13364-10-A,RESEARCH AND DEVELOPMENT,N,,766068,165625245,,
30220054,1466322018397,2018,146632,397,43.RD,SIX IN ONE BLOW: RECONSTRUCTING THE CIRCUMSTELLAR ENVIRONMENTS OF SUPERNOVAE I,1283,Y,,,,,,N,43,RD,726000720,43,Q,,,N,3,,0,HST-GO-13392-004-A,RESEARCH AND DEVELOPMENT,N,,766068,165625245,,
30220055,1466322018398,2018,146632,398,43.RD,"FILLING THE GAP-NEAR UV, OPTICAL AND NEAR IR EXTINCTION",2984,Y,,,,,,N,43,RD,726000720,43,Q,,,N,3,,0,HST-GO-13760-002-A,RESEARCH AND DEVELOPMENT,N,,766068,165625245,,
30220057,1466322018400,2018,146632,400,43.RD,IS MUZZIO 10 THE EX-COMPANION STAR OF THE PSR B1509-58,1671,Y,,,,,,N,43,RD,726000720,43,Q,,,N,3,,0,HST-GO-14365-001-A,RESEARCH AND DEVELOPMENT,N,,766068,165625245,,
30220056,1466322018399,2018,146632,399,43.RD,SMALL MAGELLANIC CLOUD ULTRAVIOLET DUST EXTINCTION: A FOCUSED STUDY OF FOUR,2648,Y,,,,,,N,43,RD,726000720,43,Q,,,N,3,,0,HST-GO-14225-002-A,RESEARCH AND DEVELOPMENT,N,,766068,165625245,,
30219661,14663220184,2018,146632,4,10.U01,COOPERATIVE MANAGEMENT OF THE KISATCHIE NATIONAL FOREST PRESERVES AND WILD TURKEY MONITORING,21376,N,,,,,,Y,10,U01,726000720,10,,,,N,0,,0,13-CS-11080600-013,,N,,21376,,,
30219697,146632201840,2018,146632,40,10.931,AGRICULTURAL CONSERVATION EASEMENT PROGRAM,27631,N,,,,,,Y,10,931,726000720,10,,,,N,0,,0,,,N,,27631,,,
30220058,1466322018401,2018,146632,401,43.RD,MAPPING THE UV EXTINCTION PROPERTIES OF PHAT STARS IN M31,31943,Y,,,,,,N,43,RD,726000720,43,Q,,,N,3,,0,HST-GO-14761-001-A,RESEARCH AND DEVELOPMENT,N,,766068,165625245,,
30220059,1466322018402,2018,146632,402,43.RD,CHALLENGES TOWARDS IMPROVED FRICTION-STIR-WELDS USING ON-LINE SENSING OF WELD,6155,Y,,,,,,Y,43,RD,726000720,43,Q,,,N,3,,0,NNM13AA02G,RESEARCH AND DEVELOPMENT,N,,766068,165625245,,
30220060,1466322018403,2018,146632,403,43.RD,INTEGRATED MONITORING AWARENESS,105299,Y,,,,,,N,43,RD,726000720,43,Q,,,N,3,,0,NNX16CS15C,RESEARCH AND DEVELOPMENT,N,,766068,165625245,,
30220061,1466322018404,2018,146632,404,43.RD,HYPERBARIC THERMAL CONDUCTIVITY PROPERTY CHARACTERIZATION OF NON-POROUS INSULATION MATERIAL,9611,Y,,,,,,N,43,RD,726000720,43,Q,,,N,3,,0,NNX17CP33P,RESEARCH AND DEVELOPMENT,N,,766068,165625245,,
30220062,1466322018405,2018,146632,405,43.RD,OPERATION OF THE NATIONAL CENTER FOR ADVANCED MANUFACTURING,600000,Y,,,,,,N,43,RD,726000720,43,Q,,,N,3,,0,S3-0000264,RESEARCH AND DEVELOPMENT,N,,766068,165625245,,
30220063,1466322018406,2018,146632,406,45.024,PROMOTION OF THE ARTS_GRANTS TO ORGANIZATIONS AND INDIVIDUALS,9251,N,,,,,,Y,45,024,726000720,45,,,,N,0,,0,,,N,,9251,,,
30220064,1466322018407,2018,146632,407,45.025,PROMOTION OF THE ARTS_PARTNERSHIP AGREEMENTS,473526,N,,,,,,Y,45,025,726000720,45,,,,N,0,,176800,,,Y,,473526,,,
30220065,1466322018408,2018,146632,408,45.129,PROMOTION OF THE HUMANITIES_FEDERAL/STATE PARTNERSHIP,3500,N,,,,,,N,45,129,726000720,45,,,,N,0,,0,,,N,,3898,,,
30220066,1466322018409,2018,146632,409,45.149,PROMOTION OF THE HUMANITIES_DIVISION OF PRESERVATION AND ACCESS,810,N,,,,,,Y,45,149,726000720,45,,,,N,0,,0,,,N,,810,,,
30219698,146632201841,2018,146632,41,10.950,AGRICULTURAL STATISTICS REPORTS,436,N,,,,,,Y,10,950,726000720,10,,,,N,0,,0,,,N,,4436,,,
30220067,1466322018410,2018,146632,410,45.164,PROMOTION OF THE HUMANITIES_PUBLIC PROGRAMS,1200,N,,,,,,N,45,164,726000720,45,,,,N,0,,0,,,N,,1200,,,
30220068,1466322018411,2018,146632,411,45.169,PROMOTION OF THE HUMANITIES_OFFICE OF DIGITAL HUMANITIES,15133,N,,,,,,Y,45,169,726000720,45,,,,N,0,,852,,,Y,,54249,,,
30220069,1466322018412,2018,146632,412,45.310,GRANTS TO STATES,2207571,N,,,,,,Y,45,310,726000720,45,,,,N,0,,0,,,N,,2207571,,,
30220070,1466322018413,2018,146632,413,45.U01,NATIONAL FOLKLORE ARCHIVES INITIATIVE CATALOGING,-10,N,,,,,,N,45,U01,726000720,45,,,,N,0,,0,43458,,N,,-10,,,
30220071,1466322018414,2018,146632,414,45.129,PROMOTION OF THE HUMANITIES_FEDERAL/STATE PARTNERSHIP,398,Y,,,,,,N,45,129,726000720,45,Q,,,N,3,,0,,RESEARCH AND DEVELOPMENT,N,,3898,165625245,,
30220072,1466322018415,2018,146632,415,45.169,PROMOTION OF THE HUMANITIES_OFFICE OF DIGITAL HUMANITIES,39116,Y,,,,,,Y,45,169,726000720,45,Q,,,N,3,,0,,RESEARCH AND DEVELOPMENT,N,,54249,165625245,,
30220073,1466322018416,2018,146632,416,47.U01,NSF IPA AGREEMENT,212324,N,,,,,,Y,47,U01,726000720,47,,,,N,0,,0,IPA,,N,,212324,,,
30220074,1466322018417,2018,146632,417,47.U02,NSF GRAD FELLOWSHIP,44564,N,,,,,,Y,47,U02,726000720,47,,,,N,0,,0,NGF,,N,,44564,,,
30220075,1466322018418,2018,146632,418,47.041,ENGINEERING GRANTS,2046597,Y,,,,,,Y,47,041,726000720,47,Q,,,N,3,,33808,,RESEARCH AND DEVELOPMENT,Y,,2212030,165625245,,
30220076,1466322018419,2018,146632,419,47.041,ENGINEERING GRANTS,165433,Y,,,,,,N,47,041,726000720,47,Q,,,N,3,,0,,RESEARCH AND DEVELOPMENT,N,,2212030,165625245,,
30219699,146632201842,2018,146632,42,10.961,SCIENTIFIC COOPERATION AND RESEARCH,40609,N,,,,,,Y,10,961,726000720,10,,,,N,0,,0,,,N,,40609,,,
30220077,1466322018420,2018,146632,420,47.049,MATHEMATICAL AND PHYSICAL SCIENCES,5395373,Y,,,,,,Y,47,049,726000720,47,Q,,,N,3,,9551,,RESEARCH AND DEVELOPMENT,Y,,5577264,165625245,,
30220078,1466322018421,2018,146632,421,47.049,MATHEMATICAL AND PHYSICAL SCIENCES,181891,Y,,,,,,N,47,049,726000720,47,Q,,,N,3,,0,,RESEARCH AND DEVELOPMENT,N,,5577264,165625245,,
30220079,1466322018422,2018,146632,422,47.050,GEOSCIENCES,3605012,Y,,,,,,Y,47,050,726000720,47,Q,,,N,3,,157655,,RESEARCH AND DEVELOPMENT,Y,,3929442,165625245,,
30220080,1466322018423,2018,146632,423,47.050,GEOSCIENCES,324430,Y,,,,,,N,47,050,726000720,47,Q,,,N,3,,0,,RESEARCH AND DEVELOPMENT,N,,3929442,165625245,,
30220081,1466322018424,2018,146632,424,47.070,COMPUTER AND INFORMATION SCIENCE AND ENGINEERING,3090906,Y,,,,,,Y,47,070,726000720,47,Q,,,N,3,,35613,,RESEARCH AND DEVELOPMENT,Y,,3316520,165625245,,
30220082,1466322018425,2018,146632,425,47.070,COMPUTER AND INFORMATION SCIENCE AND ENGINEERING,225614,Y,,,,,,N,47,070,726000720,47,Q,,,N,3,,45844,,RESEARCH AND DEVELOPMENT,Y,,3316520,165625245,,
30220083,1466322018426,2018,146632,426,47.074,BIOLOGICAL SCIENCES,3245686,Y,,,,,,Y,47,074,726000720,47,Q,,,N,3,,236508,,RESEARCH AND DEVELOPMENT,Y,,3818703,165625245,,
30220084,1466322018427,2018,146632,427,47.074,BIOLOGICAL SCIENCES,573017,Y,,,,,,N,47,074,726000720,47,Q,,,N,3,,0,,RESEARCH AND DEVELOPMENT,N,,3818703,165625245,,
30220085,1466322018428,2018,146632,428,47.075,"SOCIAL, BEHAVIORAL, AND ECONOMIC SCIENCES",1094238,Y,,,,,,Y,47,075,726000720,47,Q,,,N,3,,64207,,RESEARCH AND DEVELOPMENT,Y,,1125808,165625245,,
30220086,1466322018429,2018,146632,429,47.075,"SOCIAL, BEHAVIORAL, AND ECONOMIC SCIENCES",31570,Y,,,,,,N,47,075,726000720,47,Q,,,N,3,,0,,RESEARCH AND DEVELOPMENT,N,,1125808,165625245,,
30219700,146632201843,2018,146632,43,10.962,COCHRAN FELLOWSHIP PROGRAM-INTERNATIONAL TRAINING-FOREIGN PARTICIPANT,142443,N,,,,,,Y,10,962,726000720,10,,,,N,0,,0,,,N,,142443,,,
30220087,1466322018430,2018,146632,430,47.076,EDUCATION AND HUMAN RESOURCES,4299970,Y,,,,,,Y,47,076,726000720,47,Q,,,N,5,,192598,,RESEARCH AND DEVELOPMENT,Y,,4495639,165625245,,
30220088,1466322018431,2018,146632,431,47.076,EDUCATION AND HUMAN RESOURCES,195669,Y,,,,,,N,47,076,726000720,47,Q,,,N,3,,0,,RESEARCH AND DEVELOPMENT,N,,4495639,165625245,,
30220089,1466322018432,2018,146632,432,47.078,POLAR PROGRAMS,97773,Y,,,,,,Y,47,078,726000720,47,Q,,,N,3,,0,,RESEARCH AND DEVELOPMENT,N,,96892,165625245,,
30220093,1466322018436,2018,146632,436,47.083,OFFICE OF INTEGRATIVE ACTIVITIES,6755137,Y,,,,,,Y,47,083,726000720,47,Q,,,N,5,,1521466,,RESEARCH AND DEVELOPMENT,Y,,6759481,165625245,,
30220090,1466322018433,2018,146632,433,47.078,POLAR PROGRAMS,-881,Y,,,,,,N,47,078,726000720,47,Q,,,N,3,,0,,RESEARCH AND DEVELOPMENT,N,,96892,165625245,,
30220091,1466322018434,2018,146632,434,47.079,OFFICE OF INTERNATIONAL SCIENCE AND ENGINEERING,163587,Y,,,,,,Y,47,079,726000720,47,Q,,,N,5,,0,,RESEARCH AND DEVELOPMENT,N,,163587,165625245,,
30220092,1466322018435,2018,146632,435,47.080,OFFICE OF CYBERINFRASTRUCTURE,24999,Y,,,,,,Y,47,080,726000720,47,Q,,,N,3,,0,,RESEARCH AND DEVELOPMENT,N,,24999,165625245,,
30220094,1466322018437,2018,146632,437,47.083,OFFICE OF INTEGRATIVE ACTIVITIES,4344,Y,,,,,,N,47,083,726000720,47,Q,,,N,3,,0,,RESEARCH AND DEVELOPMENT,N,,6759481,165625245,,
30220095,1466322018438,2018,146632,438,47.RD,INTERGOVERNMENTAL PERSONNEL ACT (IPA) AGREEMENT - RAHUL T SHAH,192349,Y,,,,,,Y,47,RD,726000720,47,Q,,,N,3,,0,CCF-1547616,RESEARCH AND DEVELOPMENT,N,,226421,165625245,,
30220096,1466322018439,2018,146632,439,47.RD,INTERGOVERNMENTAL PERSONNEL ACT (IPA),34072,Y,,,,,,Y,47,RD,726000720,47,Q,,,N,3,,0,DUE-1460406,RESEARCH AND DEVELOPMENT,N,,226421,165625245,,
30219701,146632201844,2018,146632,44,10.U04,ARCHEOLOGY STUDENT TRAINING,9676,N,,,,,,Y,10,U04,726000720,10,,,,N,0,,0,AST,,N,,9676,,,
30220097,1466322018440,2018,146632,440,59.037,SMALL BUSINESS DEVELOPMENT CENTERS,676279,N,,,,,,Y,59,037,726000720,59,,,,N,0,,109311,,,Y,,893959,,,
30220098,1466322018441,2018,146632,441,59.037,SMALL BUSINESS DEVELOPMENT CENTERS,217680,N,,,,,,N,59,037,726000720,59,,,,N,0,,10000,,,Y,,893959,,,
30220099,1466322018442,2018,146632,442,59.058,FEDERAL AND STATE TECHNOLOGY PARTNERSHIP PROGRAM,118636,N,,,,,,Y,59,058,726000720,59,,,,N,0,,0,,,N,,118636,,,
30220100,1466322018443,2018,146632,443,59.061,STATE TRADE AND EXPORT PROMOTION PILOT GRANT PROGRAM,66257,N,,,,,,Y,59,061,726000720,59,,,,N,0,,0,,,N,,66257,,,
30220101,1466322018444,2018,146632,444,59.U01,MARINE INDUSTRIES SCIENCE AND TECHNOLOGY (MIST) INDUSTRY CLUSTER,18483,N,,,,,,N,59,U01,726000720,59,,,,N,0,,0,USM-GR015198-02,,N,,18483,,,
30220102,1466322018445,2018,146632,445,64.015,VETERANS STATE NURSING HOME CARE,36100723,N,,,,,,Y,64,015,726000720,64,,,,N,0,,0,,,N,,36100723,,,
