ELECAUDITSID,ID,AUDITYEAR,DBKEY,CFDASEQNUM,CFDA,FEDERALPROGRAMNAME,AMOUNT,MAJORPROGRAM,TYPEREQUIREMENT,QCOSTS2,FINDINGS,FINDINGREFNUMS,RD,DIRECT,CFDA_PREFIX,CFDA_EXT,EIN,CFDA2,TYPEREPORT_MP,TYPEREPORT_MP_OVERRIDE,ARRA,LOANS,FINDINGSCOUNT,LOANBALANCE,PASSTHROUGHAMOUNT,AWARDIDENTIFICATION,CLUSTERNAME,PASSTHROUGHAWARD,STATECLUSTERNAME,PROGRAMTOTAL,CLUSTERTOTAL,OTHERCLUSTERNAME,CFDAPROGRAMNAME
30435738,120757201810,2018,120757,10,93.568,DEPT OF HEALTH & HUMAN SVC - PASSED THRU CA STATE DEPT OF CSD - LOW- INCOME HOUSING ENERGY ASSISTANCE - .47 EHA,188220,Y,,,,,,N,93,568,942797280,93,U,,,N,0,,0,19B-5014,,N,,5251954,,,
30435743,120757201811,2018,120757,11,93.568,DEPT OF HEALTH & HUMAN SVC - PASSED THRU CA STATE DEPT OF CSD - LOW-INCOME HOME ENERGY ASSISTANCE - .67 WEATHERIZATION,303412,Y,,,,,,N,93,568,942797280,93,U,,,N,0,,0,19B-5014,,N,,5251954,,,
30435658,12075720182,2018,120757,2,93.568,DEPT OF HEALTH & HUMAN SVC - PASSED THRU CA STATE DEPT OF CSD - LOW-INCOME HOME ENERGY ASSISTANCE - .47 EHA,479488,Y,,,,,,N,93,568,942797280,93,U,,,N,0,,0,17B-3014,,N,,5251954,,,
30435672,12075720183,2018,120757,3,93.568,DEPT OF HEALTH & HUMAN SVC - PASSED THRU CA STATE DEPT OF CSD - LOW-INCOME HOME ENERGY ASSISTANCE - .67 WEATHERIZATION,243652,Y,,,,,,N,93,568,942797280,93,U,,,N,0,,0,17B-3014,,N,,5251954,,,
30435675,12075720184,2018,120757,4,93.568,DEPT OF HEALTH & HUMAN SVC - PASSED THRU CA STATE DEPT OF CSD - LOW-INCOME HOME ENERGY ASSISTANCE - .68 SWEATS,13512,Y,,,,,,N,93,568,942797280,93,U,,,N,0,,0,17B-3014,,N,,5251954,,,
30435705,12075720185,2018,120757,5,93.568,DEPT OF HEALTH & HUMAN SVC - PASSED THRU CA STATE DEPT OF CSD - LOW-INCOME HOME ENERGY ASSISTANCE - .17 ASSURANCE 16,156476,Y,,,,,,N,93,568,942797280,93,U,,,N,0,,0,18B-4014,,N,,5251954,,,
30435735,12075720189,2018,120757,9,93.568,DEPT OF HEALTH & HUMAN SVC - PASSED THRU CA STATE DEPT OF CSD - LOW-INCOME HOME ENERGY ASSISTANCE - .17 ASSURANCE 16,0,Y,,,,,,N,93,568,942797280,93,U,,,N,0,,0,19B-5014,,N,,5251954,,,
30435709,12075720186,2018,120757,6,93.568,DEPT OF HEALTH & HUMAN SVC - PASSED THRU CA STATE DEPT OF CSD - LOW-INCOME HOME ENERGY ASSISTANCE - .47 EHA,1851145,Y,,,,,,N,93,568,942797280,93,U,,,N,0,,0,18B-4014,,N,,5251954,,,
30435723,12075720187,2018,120757,7,93.568,DEPT OF HEALTH & HUMAN SVC - PASSED THRU CA STATE DEPT OF CSD - LOW-INCOME HOME ENERGY ASSISTANCE - .67 WEATHERIZATION,1764848,Y,,,,,,N,93,568,942797280,93,U,,,N,0,,0,18B-4014,,N,,5251954,,,
30435727,12075720188,2018,120757,8,93.568,DEPT OF HEALTH & HUMAN SVC - PASSED THRU CA STATE DEPT OF CSD - LOW-INCOME HOME ENERGY ASSISTANCE - .68 SWEATS,199999,Y,,,,,,N,93,568,942797280,93,U,,,N,0,,0,18B-4014,,N,,5251954,,,
29597696,12615020181,2018,126150,1,14.157,SUPPORTIVE HOUSING FOR THE ELDERLY,6411721,Y,,,,,,Y,14,157,953787638,14,U,,,Y,0,6299888,0,SECTION 2 INSURED LOAN,,N,,7279377,,,
29597697,12615020182,2018,126150,2,14.157,SUPPORTIVE HOUSING FOR THE ELDERLY,867656,Y,,,,,,Y,14,157,953787638,14,U,,,N,0,,0,SECTION 8 ASSISTANCE,,N,,7279377,,,
30648115,129695201810,2018,129695,10,84.173,SPECIAL EDUCATION_PRESCHOOL GRANTS,13235,N,,,,,,N,84,173,636000896,84,,,,N,0,,0,,SPECIAL EDUCATION CLUSTER (IDEA),N,,13235,744332,,SPECIAL EDUCATION_PRESCHOOL GRANTS
30648089,12969520181,2018,129695,1,10.555,NATIONAL SCHOOL LUNCH PROGRAM - CASH ASSISTANCE,1407406,N,,,,,,N,10,555,636000896,10,,,,N,0,,0,,CHILD NUTRITION CLUSTER,N,,1560570,2490004,,NATIONAL SCHOOL LUNCH PROGRAM
30648117,129695201811,2018,129695,11,84.048,CAREER AND TECHNICAL EDUCATION -- BASIC GRANTS TO STATES,105166,N,,,,,,N,84,048,636000896,84,,,,N,0,,0,,,N,,105166,0,,CAREER AND TECHNICAL EDUCATION -- BASIC GRANTS TO STATES
30648118,129695201812,2018,129695,12,84.287,TWENTY-FIRST CENTURY COMMUNITY LEARNING CENTERS,132406,N,,,,,,N,84,287,636000896,84,,,,N,0,,0,,,N,,132406,0,,TWENTY-FIRST CENTURY COMMUNITY LEARNING CENTERS
30648120,129695201813,2018,129695,13,84.358,RURAL EDUCATION,46117,N,,,,,,N,84,358,636000896,84,,,,N,0,,0,,,N,,46117,0,,RURAL EDUCATION
30648121,129695201814,2018,129695,14,84.365,ENGLISH LANGUAGE ACQUISITION STATE GRANTS,31614,N,,,,,,N,84,365,636000896,84,,,,N,0,,0,,,N,,31614,0,,ENGLISH LANGUAGE ACQUISITION STATE GRANTS
30648122,129695201815,2018,129695,15,84.367,SUPPORTING EFFECTIVE INSTRUCTION STATE GRANTS,158848,N,,,,,,N,84,367,636000896,84,,,,N,0,,0,,,N,,158848,0,,IMPROVING TEACHER QUALITY STATE GRANTS
30648126,129695201816,2018,129695,16,84.424,STUDENT SUPPORT AND ACADEMIC ENRICHMENT PROGRAM,26462,N,,,,,,N,84,424,636000896,84,,,,N,0,,0,,,N,,26462,0,,STUDENT SUPPORT AND ACADEMIC ENRICHMENT PROGRAM
30648127,129695201817,2018,129695,17,84.419,PRESCHOOL DEVELOPMENT GRANTS,33548,N,,,,,,N,84,419,636000896,84,,,,N,0,,0,,,N,,33548,0,,PRESCHOOL DEVELOPMENT GRANTS
30648128,129695201818,2018,129695,18,97.036,DISASTER GRANTS - PUBLIC ASSISTANCE (PRESIDENTIALLY DECLARED DISASTERS),5562622,Y,,,,,,N,97,036,636000896,97,U,,,N,0,,0,,,N,,5562622,0,,DISASTER GRANTS - PUBLIC ASSISTANCE (PRESIDENTIALLY DECLARED DISASTERS)
30648129,129695201819,2018,129695,19,96.001,SOCIAL SECURITY_DISABILITY INSURANCE,900,N,,,,,,N,96,001,636000896,96,,,,N,0,,0,,,N,,900,0,,SOCIAL SECURITY_DISABILITY INSURANCE
30648092,12969520182,2018,129695,2,10.555,NATIONAL SCHOOL LUNCH PROGRAM - NON-CASH ASSISTANCE,153164,N,,,,,,N,10,555,636000896,10,,,,N,0,,0,,CHILD NUTRITION CLUSTER,N,,1560570,2490004,,NATIONAL SCHOOL LUNCH PROGRAM
30648094,12969520183,2018,129695,3,10.553,SCHOOL BREAKFAST PROGRAM,929434,N,,,,,,N,10,553,636000896,10,,,,N,0,,0,,CHILD NUTRITION CLUSTER,N,,929434,2490004,,SCHOOL BREAKFAST PROGRAM
30648107,12969520184,2018,129695,4,10.579,CHILD NUTRITION DISCRETIONARY GRANTS LIMITED AVAILABILITY,58000,N,,,,,,N,10,579,636000896,10,,,,N,0,,0,,,N,,58000,0,,CHILD NUTRITION DISCRETIONARY GRANTS LIMITED AVAILABILITY
30648109,12969520185,2018,129695,5,10.560,STATE ADMINISTRATIVE EXPENSES FOR CHILD NUTRITION,9816,N,,,,,,N,10,560,636000896,10,,,,N,0,,0,,,N,,9816,0,,STATE ADMINISTRATIVE EXPENSES FOR CHILD NUTRITION
30648110,12969520186,2018,129695,6,10.665,SCHOOLS AND ROADS - GRANTS TO STATES,1446,N,,,,,,N,10,665,636000896,10,,,,N,0,,0,,,N,,1446,0,,SCHOOLS AND ROADS - GRANTS TO STATES
30648111,12969520187,2018,129695,7,23.002,APPALACHIAN AREA DEVELOPMENT,169760,N,,,,,,Y,23,002,636000896,23,,,,N,0,,0,,,N,,169760,0,,APPALACHIAN AREA DEVELOPMENT
30648113,12969520188,2018,129695,8,84.010,TITLE I GRANTS TO LOCAL EDUCATIONAL AGENCIES,982763,N,,,,,,N,84,010,636000896,84,,,,N,0,,0,,,N,,982763,0,,TITLE I GRANTS TO LOCAL EDUCATIONAL AGENCIES
30648114,12969520189,2018,129695,9,84.027,SPECIAL EDUCATION_GRANTS TO STATES,731097,N,,,,,,N,84,027,636000896,84,,,,N,0,,0,,SPECIAL EDUCATION CLUSTER (IDEA),N,,731097,744332,,SPECIAL EDUCATION_GRANTS TO STATES
29308125,138430201810,2018,138430,10,84.299,INDIAN EDUCATION -- SPECIAL PROGRAMS FOR INDIAN CHILDREN,227989,N,,,,,,Y,84,299,826000843,84,,,,N,0,,0,,,N,,227989,,,
29307988,13843020181,2018,138430,1,10.665,SCHOOLS AND ROADS - GRANTS TO STATES,74,N,,,,,,Y,10,665,826000843,10,,,,N,0,,0,,,N,,74,,,
29308130,138430201811,2018,138430,11,84.215,FUND FOR THE IMPROVEMENT OF EDUCATION,112618,N,,,,,,Y,84,215,826000843,84,,,,N,0,,0,,,N,,112618,,,
29308137,138430201812,2018,138430,12,84.358,RURAL EDUCATION,28832,N,,,,,,Y,84,358,826000843,84,,,,N,0,,0,,,N,,28832,,,
29308143,138430201813,2018,138430,13,84.010,TITLE I GRANTS TO LOCAL EDUCATIONAL AGENCIES,155704,N,,,,,,N,84,010,826000843,84,,,,N,0,,0,,,N,,155704,,,
29308150,138430201814,2018,138430,14,84.377,SCHOOL IMPROVEMENT GRANTS,229430,N,,,,,,N,84,377,826000843,84,,,,N,0,,0,,,N,,229430,,,
29308155,138430201815,2018,138430,15,84.027,SPECIAL EDUCATION_GRANTS TO STATES,121568,N,,,,,,N,84,027,826000843,84,,,,N,0,,0,,SPECIAL EDUCATION CLUSTER (IDEA),N,,121568,124607,,
29308158,138430201816,2018,138430,16,84.173,SPECIAL EDUCATION_PRESCHOOL GRANTS,3039,N,,,,,,N,84,173,826000843,84,,,,N,0,,0,,SPECIAL EDUCATION CLUSTER (IDEA),N,,3039,124607,,
29308161,138430201817,2018,138430,17,84.287,TWENTY-FIRST CENTURY COMMUNITY LEARNING CENTERS,143433,N,,,,,,N,84,287,826000843,84,,,,N,0,,0,,,N,,143433,,,
29308174,138430201818,2018,138430,18,84.334,GAINING EARLY AWARENESS AND READINESS FOR UNDERGRADUATE PROGRAMS,49638,N,,,,,,N,84,334,826000843,84,,,,N,0,,0,,,N,,49638,,,
29308206,138430201819,2018,138430,19,84.424,STUDENT SUPPORT AND ACADEMIC ENRICHMENT PROGRAM,10000,N,,,,,,N,84,424,826000843,84,,,,N,0,,0,,,N,,10000,,,
29308034,13843020182,2018,138430,2,10.555,NATIONAL SCHOOL LUNCH PROGRAM,235419,N,,,,,,N,10,555,826000843,10,,,,N,0,,0,,FOOD DISTRIBUTION CLUSTER,N,,235419,388010,,
29308220,138430201820,2018,138430,20,84.367,IMPROVING TEACHER QUALITY STATE GRANTS,26636,N,,,,,,N,84,367,826000843,84,,,,N,0,,0,,,N,,26636,,,
29308267,138430201821,2018,138430,21,93.243,SUBSTANCE ABUSE AND MENTAL HEALTH SERVICES_PROJECTS OF REGIONAL AND NATIONAL SIGNIFICANCE,96296,N,,,,,,N,93,243,826000843,93,,,,N,0,,0,,,N,,96296,,,
29308060,13843020183,2018,138430,3,10.553,SCHOOL BREAKFAST PROGRAM,80026,N,,,,,,N,10,553,826000843,10,,,,N,0,,0,,FOOD DISTRIBUTION CLUSTER,N,,80026,388010,,
29308076,13843020184,2018,138430,4,10.558,CHILD AND ADULT CARE FOOD PROGRAM,19580,N,,,,,,N,10,558,826000843,10,,,,N,0,,0,,FOOD DISTRIBUTION CLUSTER,N,,19580,388010,,
29308078,13843020185,2018,138430,5,10.559,SUMMER FOOD SERVICE PROGRAM FOR CHILDREN,40027,N,,,,,,N,10,559,826000843,10,,,,N,0,,0,,FOOD DISTRIBUTION CLUSTER,N,,40027,388010,,
29308082,13843020186,2018,138430,6,10.560,STATE ADMINISTRATIVE EXPENSES FOR CHILD NUTRITION,228,N,,,,,,N,10,560,826000843,10,,,,N,0,,0,,FOOD DISTRIBUTION CLUSTER,N,,228,388010,,
29308085,13843020187,2018,138430,7,10.582,FRESH FRUIT AND VEGETABLE PROGRAM,12730,N,,,,,,N,10,582,826000843,10,,,,N,0,,0,,FOOD DISTRIBUTION CLUSTER,N,,12730,388010,,
29308110,13843020188,2018,138430,8,84.041,IMPACT AID,2841659,Y,,,,,,Y,84,041,826000843,84,U,,,N,0,,0,,,N,,2841659,,,
29308114,13843020189,2018,138430,9,84.060,INDIAN EDUCATION_GRANTS TO LOCAL EDUCATIONAL AGENCIES,81005,Y,,,,,,Y,84,060,826000843,84,U,,,N,0,,0,,,N,,81005,,,
29518769,14554920181,2018,145549,1,84.007,FEDERAL SUPPLEMENTAL EDUCATIONAL OPPORTUNITY GRANTS,29569,Y,,,,,,Y,84,007,480732624,84,U,,,N,0,,0,,STUDENT FINANCIAL AID,N,,29569,4500112,,
29518778,145549201810,2018,145549,10,10.558,CHILD AND ADULT CARE FOOD PROGRAM,7947,N,,,,,,N,10,558,480732624,10,,,,N,0,,0,,,N,,7947,,,
29518779,145549201811,2018,145549,11,10.351,RURAL BUSINESS DEVELOPMENT GRANT,912,N,,,,,,Y,10,351,480732624,10,,,,N,0,,0,,,N,,912,,,
29518770,14554920182,2018,145549,2,84.033,FEDERAL WORK-STUDY PROGRAM,95828,Y,,,,,,Y,84,033,480732624,84,U,,,N,0,,0,,STUDENT FINANCIAL AID,N,,95828,4500112,,
29518771,14554920183,2018,145549,3,84.063,FEDERAL PELL GRANT PROGRAM,2399826,Y,,,,,,Y,84,063,480732624,84,U,,,N,0,,0,,STUDENT FINANCIAL AID,N,,2399826,4500112,,
29518772,14554920184,2018,145549,4,84.268,FEDERAL DIRECT STUDENT LOANS,1974889,Y,,,,,,Y,84,268,480732624,84,U,,,N,0,,0,,STUDENT FINANCIAL AID,N,,1974889,4500112,,
29518773,14554920185,2018,145549,5,84.042,TRIO_STUDENT SUPPORT SERVICES,256755,N,,,,,,Y,84,042,480732624,84,,,,N,0,,0,,,N,,256755,,,
29518774,14554920186,2018,145549,6,84.002,ADULT EDUCATION - BASIC GRANTS TO STATES,31500,N,,,,,,N,84,002,480732624,84,,,,N,0,,0,,,N,,31500,,,
29518775,14554920187,2018,145549,7,84.048,CAREER AND TECHNICAL EDUCATION -- BASIC GRANTS TO STATES,70663,N,,,,,,N,84,048,480732624,84,,,,N,0,,0,,,N,,70663,,,
29518776,14554920188,2018,145549,8,10.560,STATE ADMINISTRATIVE EXPENSES FOR CHILD NUTRITION,50,N,,,,,,N,10,560,480732624,10,,,,N,0,,0,,,N,,50,,,
29518777,14554920189,2018,145549,9,10.574,TEAM NUTRITION GRANTS,442,N,,,,,,N,10,574,480732624,10,,,,N,0,,0,,,N,,442,,,
30691022,158370201811,2018,158370,11,93.558,TEMPORARY ASSISTANCE FOR NEEDY FAMILIES,3123399,N,,,,,,N,93,558,156000454,93,,,,N,0,,0,,,N,,3123399,0,,TEMPORARY ASSISTANCE FOR NEEDY FAMILIES
30690927,15837020181,2018,158370,1,10.561,STATE ADMINISTRATIVE MATCHING GRANTS FOR THE SUPPLEMENTAL NUTRITION ASSISTANCE PROGRAM,548722,N,,,,,,N,10,561,156000454,10,,,,N,0,,0,,,N,,548722,0,,STATE ADMINISTRATIVE MATCHING GRANTS FOR THE SUPPLEMENTAL NUTRITION ASSISTANCE PROGRAM
30691018,158370201810,2018,158370,10,93.667,SOCIAL SERVICES BLOCK GRANT,439725,N,,,,,,N,93,667,156000454,93,,,,N,0,,0,,,N,,439725,0,,SOCIAL SERVICES BLOCK GRANT
30691025,158370201812,2018,158370,12,93.568,LOW-INCOME HOME ENERGY ASSISTANCE,4999877,Y,,,,,,N,93,568,156000454,93,U,,,N,0,,0,,,N,,4999877,0,,LOW-INCOME HOME ENERGY ASSISTANCE
30691028,158370201813,2018,158370,13,93.575,CHILD CARE AND DEVELOPMENT BLOCK GRANT,1204277,Y,,,,,,N,93,575,156000454,93,U,,,N,0,,0,93.596,,N,,1204277,0,,CHILD CARE AND DEVELOPMENT BLOCK GRANT
30691038,158370201814,2018,158370,14,93.563,CHILD SUPPORT ENFORCEMENT,447353,N,,,,,,N,93,563,156000454,93,,,,N,0,,0,,,N,,447353,0,,CHILD SUPPORT ENFORCEMENT
30691140,158370201815,2018,158370,15,93.658,FOSTER CARE_TITLE IV-E,1030848,Y,,,,,,N,93,658,156000454,93,U,,,N,0,,0,,,N,,1030848,0,,FOSTER CARE_TITLE IV-E
30691145,158370201816,2018,158370,16,93.659,ADOPTION ASSISTANCE,9487,N,,,,,,N,93,659,156000454,93,,,,N,0,,0,,,N,,9487,0,,ADOPTION ASSISTANCE
30691147,158370201817,2018,158370,17,93.778,MEDICAL ASSISTANCE PROGRAM,1041574,Y,,,,,,N,93,778,156000454,93,U,,,N,0,,0,,,N,,1183783,0,,MEDICAL ASSISTANCE PROGRAM
30691148,158370201818,2018,158370,18,93.268,IMMUNIZATION COOPERATIVE AGREEMENTS,26175,N,,,,,,N,93,268,156000454,93,,,,N,0,,0,,,N,,26175,0,,IMMUNIZATION COOPERATIVE AGREEMENTS
30691151,158370201819,2018,158370,19,93.994,MATERNAL AND CHILD HEALTH SERVICES BLOCK GRANT TO THE STATES,21234,N,,,,,,N,93,994,156000454,93,,,,N,0,,0,,,N,,39940,0,,MATERNAL AND CHILD HEALTH SERVICES BLOCK GRANT TO THE STATES
30690960,15837020182,2018,158370,2,93.778,MEDICAL ASSISTANCE PROGRAM,51601,N,,,,,,N,93,778,156000454,93,,,,N,0,,0,,,N,,1183783,0,,MEDICAL ASSISTANCE PROGRAM
30691156,158370201820,2018,158370,20,84.181,SPECIAL EDUCATION-GRANTS FOR INFANTS AND FAMILIES,22762,N,,,,,,N,84,181,156000454,84,,,,N,0,,0,,,N,,22762,0,,SPECIAL EDUCATION-GRANTS FOR INFANTS AND FAMILIES
30691158,158370201821,2018,158370,21,93.994,MATERNAL AND CHILD HEALTH SERVICES BLOCK GRANT TO THE STATES,18706,N,,,,,,N,93,994,156000454,93,,,,N,0,,0,,,N,,39940,0,,MATERNAL AND CHILD HEALTH SERVICES BLOCK GRANT TO THE STATES
30691161,158370201822,2018,158370,22,93.778,MEDICAL ASSISTANCE PROGRAM,90608,Y,,,,,,N,93,778,156000454,93,U,,,N,0,,0,,,N,,1183783,0,,MEDICAL ASSISTANCE PROGRAM
30691169,158370201823,2018,158370,23,93.959,BLOCK GRANTS FOR PREVENTION AND TREATMENT OF SUBSTANCE ABUSE,302481,N,,,,,,N,93,959,156000454,93,,,,N,0,,66735,,,Y,,302481,0,,BLOCK GRANTS FOR PREVENTION AND TREATMENT OF SUBSTANCE ABUSE
30691183,158370201824,2018,158370,24,93.069,PUBLIC HEALTH EMERGENCY PREPAREDNESS,63691,N,,,,,,N,93,069,156000454,93,,,,N,0,,0,,,N,,63691,0,,PUBLIC HEALTH EMERGENCY PREPAREDNESS
30691185,158370201825,2018,158370,25,93.283,CENTERS FOR DISEASE CONTROL AND PREVENTION_INVESTIGATIONS AND TECHNICAL ASSISTANCE,34249,N,,,,,,N,93,283,156000454,93,,,,N,0,,0,,,N,,34249,0,,CENTERS FOR DISEASE CONTROL AND PREVENTION_INVESTIGATIONS AND TECHNICAL ASSISTANCE
30691188,158370201826,2018,158370,26,17.325,TITLE V,36871,N,,,,,,N,17,325,156000454,17,,,,N,0,,0,,,N,,36871,0,,
30691199,158370201827,2018,158370,27,20.509,FORMULA GRANTS FOR RURAL AREAS,117015,N,,,,,,N,20,509,156000454,20,,,,N,0,,0,,,N,,117676,0,,FORMULA GRANTS FOR RURAL AREAS
30691206,158370201828,2018,158370,28,20.509,FORMULA GRANTS FOR RURAL AREAS,661,N,,,,,,N,20,509,156000454,20,,,,N,0,,0,,,N,,117676,0,,FORMULA GRANTS FOR RURAL AREAS
30691219,158370201829,2018,158370,29,20.205,HIGHWAY PLANNING AND CONSTRUCTION,1211036,Y,,,,,,N,20,205,156000454,20,U,,,N,0,,0,,HIGHWAY PLANNING AND CONSTRUCTION CLUSTER,N,,1211036,1211036,,HIGHWAY PLANNING AND CONSTRUCTION
30690973,15837020183,2018,158370,3,93.043,"SPECIAL PROGRAMS FOR THE AGING_TITLE III, PART D_DISEASE PREVENTION AND HEALTH PROMOTION SERVICES",3633,N,,,,,,N,93,043,156000454,93,,,,N,0,,0,,,N,,3633,0,,"SPECIAL PROGRAMS FOR THE AGING_TITLE III, PART D_DISEASE PREVENTION AND HEALTH PROMOTION SERVICES"
30691233,158370201830,2018,158370,30,20.601,ALCOHOL IMPAIRED DRIVING COUNTERMEASURES INCENTIVE GRANTS I,3460,N,,,,,,N,20,601,156000454,20,,,,N,0,,0,,HIGHWAY SAFETY CLUSTER,N,,3460,3460,,ALCOHOL IMPAIRED DRIVING COUNTERMEASURES INCENTIVE GRANTS I
30691246,158370201831,2018,158370,31,97.067,HOMELAND SECURITY GRANT PROGRAM,61844,N,,,,,,N,97,067,156000454,97,,,,N,0,,0,,,N,,216034,0,,HOMELAND SECURITY GRANT PROGRAM
30691250,158370201832,2018,158370,32,97.067,HOMELAND SECURITY GRANT PROGRAM,14484,N,,,,,,N,97,067,156000454,97,,,,N,0,,0,,,N,,216034,0,,HOMELAND SECURITY GRANT PROGRAM
30691256,158370201833,2018,158370,33,97.067,HOMELAND SECURITY GRANT PROGRAM,17500,N,,,,,,N,97,067,156000454,97,,,,N,0,,0,,,N,,216034,0,,HOMELAND SECURITY GRANT PROGRAM
30691294,158370201834,2018,158370,34,97.067,HOMELAND SECURITY GRANT PROGRAM,6847,N,,,,,,N,97,067,156000454,97,,,,N,0,,0,,,N,,216034,0,,HOMELAND SECURITY GRANT PROGRAM
30691304,158370201835,2018,158370,35,97.067,HOMELAND SECURITY GRANT PROGRAM,115359,N,,,,,,N,97,067,156000454,97,,,,N,0,,0,,,N,,216034,0,,HOMELAND SECURITY GRANT PROGRAM
30692060,158370201836,2018,158370,36,97.036,DISASTER GRANTS - PUBLIC ASSISTANCE (PRESIDENTIALLY DECLARED DISASTERS),3374,N,,,,,,N,97,036,156000454,97,,,,N,0,,0,,,N,,3374,0,,DISASTER GRANTS - PUBLIC ASSISTANCE (PRESIDENTIALLY DECLARED DISASTERS)
30692142,158370201837,2018,158370,37,97.042,EMERGENCY MANAGEMENT PERFORMANCE GRANTS,24202,N,,,,,,N,97,042,156000454,97,,,,N,0,,0,,,N,,24202,0,,EMERGENCY MANAGEMENT PERFORMANCE GRANTS
30692161,158370201838,2018,158370,38,16.607,BULLETPROOF VEST PARTNERSHIP PROGRAM,1540,N,,,,,,N,16,607,156000454,16,,,,N,0,,0,,,N,,1540,0,,BULLETPROOF VEST PARTNERSHIP PROGRAM
30692162,158370201839,2018,158370,39,16.579,BYRNE DISCRETIONARY PROGRAM,3490,N,,,,,,N,16,579,156000454,16,,,,N,0,,0,,,N,,3490,0,,
30690988,15837020184,2018,158370,4,93.052,"NATIONAL FAMILY CAREGIVER SUPPORT, TITLE III, PART E",35101,N,,,,,,N,93,052,156000454,93,,,,N,0,,0,,,N,,35101,0,,"NATIONAL FAMILY CAREGIVER SUPPORT, TITLE III, PART E"
30691010,15837020187,2018,158370,7,93.053,NUTRITION SERVICES INCENTIVE PROGRAM,119319,N,,,,,,N,93,053,156000454,93,,,,N,0,,0,,AGING CLUSTER,N,,119319,301828,,NUTRITION SERVICES INCENTIVE PROGRAM
30692173,158370201840,2018,158370,40,16.922,EQUITABLE SHARING PROGRAM,3191,N,,,,,,N,16,922,156000454,16,,,,N,0,,0,,,N,,3191,0,,EQUITABLE SHARING PROGRAM
30690994,15837020185,2018,158370,5,93.044,"SPECIAL PROGRAMS FOR THE AGING_TITLE III, PART B_GRANTS FOR SUPPORTIVE SERVICES AND SENIOR CENTERS",66444,N,,,,,,N,93,044,156000454,93,,,,N,0,,0,,AGING CLUSTER,N,,66444,301828,,"SPECIAL PROGRAMS FOR THE AGING_TITLE III, PART B_GRANTS FOR SUPPORTIVE SERVICES AND SENIOR CENTERS"
30691006,15837020186,2018,158370,6,93.045,"SPECIAL PROGRAMS FOR THE AGING_TITLE III, PART C_NUTRITION SERVICES",116065,N,,,,,,N,93,045,156000454,93,,,,N,0,,0,,AGING CLUSTER,N,,116065,301828,,"SPECIAL PROGRAMS FOR THE AGING_TITLE III, PART C_NUTRITION SERVICES"
30691014,15837020188,2018,158370,8,93.779,"CENTERS FOR MEDICARE AND MEDICAID SERVICES (CMS) RESEARCH, DEMONSTRATIONS AND EVALUATIONS",18350,N,,,,,,N,93,779,156000454,93,,,,N,0,,0,,,N,,18350,0,,"CENTERS FOR MEDICARE AND MEDICAID SERVICES (CMS) RESEARCH, DEMONSTRATIONS AND EVALUATIONS"
30691015,15837020189,2018,158370,9,93.071,MEDICARE ENROLLMENT ASSISTANCE PROGRAM,13909,N,,,,,,N,93,071,156000454,93,,,,N,0,,0,,,N,,13909,0,,MEDICARE ENROLLMENT ASSISTANCE PROGRAM
30317938,16075820181,2018,160758,1,10.553,SCHOOL BREAKFAST PROGRAM,102660,Y,,,,,,N,10,553,116001992,10,U,,,N,0,,0,,CHILD NUTRITION CLUSTER,N,,102660,1094432,,
30317947,160758201810,2018,160758,10,84.365,ENGLISH LANGUAGE ACQUISITION GRANTS,755,N,,,,,,N,84,365,116001992,84,,,,N,0,,0,,,N,,40304,,,
30317948,160758201811,2018,160758,11,84.365,ENGLISH LANGUAGE ACQUISITION GRANTS,39549,N,,,,,,N,84,365,116001992,84,,,,N,0,,0,,,N,,40304,,,
30317949,160758201812,2018,160758,12,84.367,SUPPORTING EFFECTIVE INSTRUCTION STATE GRANTS,23373,N,,,,,,N,84,367,116001992,84,,,,N,0,,0,,,N,,192025,,,
30317950,160758201813,2018,160758,13,84.367,SUPPORTING EFFECTIVE INSTRUCTION STATE GRANTS,168652,N,,,,,,N,84,367,116001992,84,,,,N,0,,0,,,N,,192025,,,
30317951,160758201814,2018,160758,14,84.938,HURRICANE EDUCATION RECOVERY ACT,21500,N,,,,,,N,84,938,116001992,84,,,,N,0,,0,,,N,,21500,,,
30317939,16075820182,2018,160758,2,10.555,NATIONAL SCHOOL LUNCH PROGRAM,167713,Y,,,,,,N,10,555,116001992,10,U,,,N,0,,0,,CHILD NUTRITION CLUSTER,N,,991772,1094432,,
30317940,16075820183,2018,160758,3,10.555,NATIONAL SCHOOL LUNCH PROGRAM,824059,Y,,,,,,N,10,555,116001992,10,U,,,N,0,,0,,CHILD NUTRITION CLUSTER,N,,991772,1094432,,
30317941,16075820184,2018,160758,4,84.010,TITLE I GRANTS TO LOCAL EDUCATIONAL AGENCIES,7171,Y,,,,,,N,84,010,116001992,84,U,,,N,0,,0,,,N,,594806,,,
30317942,16075820185,2018,160758,5,84.010,TITLE I GRANTS TO LOCAL EDUCATIONAL AGENCIES,587635,Y,,,,,,N,84,010,116001992,84,U,,,N,2,,0,,,N,,594806,,,
30317943,16075820186,2018,160758,6,84.027,SPECIAL EDUCATION GRANTS TO STATES,-96400,N,,,,,,N,84,027,116001992,84,,,,N,0,,0,,SPECIAL EDUCATION CLUSTER,N,,1332259,1416516,,
30317944,16075820187,2018,160758,7,84.027,SPECIAL EDUCATION GRANTS TO STATES,1428659,N,,,,,,N,84,027,116001992,84,,,,N,0,,0,,SPECIAL EDUCATION CLUSTER,N,,1332259,1416516,,
30317945,16075820188,2018,160758,8,84.173,SPECIAL EDUCATION PRESCHOOL GRANTS,84257,N,,,,,,N,84,173,116001992,84,,,,N,0,,0,,SPECIAL EDUCATION CLUSTER,N,,84257,1416516,,
30317946,16075820189,2018,160758,9,84.048,CAREER AND TECHNICAL EDUCATION - BASIC GRANTS TO STATES,26512,N,,,,,,N,84,048,116001992,84,,,,N,0,,0,,,N,,26512,,,
30504152,16945820181,2018,169458,1,20.509,FORMULA GRANTS FOR RURAL AREAS,7992,N,,,,,,N,20,509,232150003,20,,,,N,1,,0,,,N,,467032,0,,FORMULA GRANTS FOR RURAL AREAS
30504153,16945820182,2018,169458,2,20.509,FORMULA GRANTS FOR RURAL AREAS,435000,N,,,,,,N,20,509,232150003,20,,,,N,1,,0,,,N,,467032,0,,FORMULA GRANTS FOR RURAL AREAS
30504154,16945820183,2018,169458,3,20.509,FORMULA GRANTS FOR RURAL AREAS,24040,N,,,,,,N,20,509,232150003,20,,,,N,1,,0,,,N,,467032,0,,FORMULA GRANTS FOR RURAL AREAS
30504155,16945820184,2018,169458,4,20.205,HIGHWAY PLANNING AND CONSTRUCTION,65000,N,,,,,,N,20,205,232150003,20,,,,N,1,,0,,HIGHWAY PLANNING AND CONSTRUCTION CLUSTER,N,,65000,65000,,HIGHWAY PLANNING AND CONSTRUCTION
30504156,16945820185,2018,169458,5,93.778,MEDICAL ASSISTANCE PROGRAM,906178,Y,,,,,,N,93,778,232150003,93,U,,,N,3,,0,,MEDICAID CLUSTER,N,,906178,906178,,MEDICAL ASSISTANCE PROGRAM
30619577,17701520181,2018,177015,1,20.106,AIRPORT IMPROVEMENT PROGRAM,14536068,Y,,,,,,Y,20,106,910856218,20,U,,,N,1,,0,,,N,,14536068,0,,AIRPORT IMPROVEMENT PROGRAM
29828162,18247420181,2018,182474,1,10.766,COMMUNITY FACILITIES LOANS AND GRANTS,8287653,Y,,,,,,Y,10,766,344428214,10,U,,,Y,0,41199330,0,,COMMUNITY FACILITIES LOANS AND GRANTS CLUSTER,N,,8287653,8287653,,
29828163,18247420182,2018,182474,2,93.301,SMALL RURAL HOSPITAL IMPROVEMENT GRANT PROGRAM,8622,N,,,,,,N,93,301,344428214,93,,,,N,0,,0,,,N,,8622,,,
29828164,18247420183,2018,182474,3,93.074,HOSPITAL PREPAREDNESS PROGRAM (HPP) AND PUBLIC HEALTH EMERGENCY PREP...,6100,N,,,,,,N,93,074,344428214,93,,,,N,0,,0,,,N,,6100,,,
30333996,18379720181,2018,183797,1,14.157,SUPPORTIVE HOUSING FOR THE ELDERLY,2274200,Y,,,,,,Y,14,157,251702103,14,U,,,Y,0,2274200,0,033-EE021,,N,,2274200,,,
30334001,18379720182,2018,183797,2,14.195,SECTION 8 HOUSING ASSISTANCE PAYMENTS PROGRAM,117136,N,,,,,,Y,14,195,251702103,14,,,,N,0,,0,PA28-5921-005,,N,,117136,,,
30633922,18429920181,2018,184299,1,84.268,FEDERAL DIRECT STUDENT LOANS,1761987,Y,,,,,,Y,84,268,135648615,84,U,,,Y,0,-1,0,,STUDENT FINANCIAL AID,N,,1761987,2917407,,FEDERAL DIRECT STUDENT LOANS
30633923,18429920182,2018,184299,2,84.063,FEDERAL PELL GRANT PROGRAM,1117428,Y,,,,,,Y,84,063,135648615,84,U,,,N,0,,0,,STUDENT FINANCIAL AID,N,,1117428,2917407,,FEDERAL PELL GRANT PROGRAM
30633924,18429920183,2018,184299,3,84.007,FEDERAL SUPPLEMENTAL EDUCATIONAL OPPORTUNITY GRANTS,19881,Y,,,,,,Y,84,007,135648615,84,U,,,N,0,,0,,STUDENT FINANCIAL AID,N,,19881,2917407,,FEDERAL SUPPLEMENTAL EDUCATIONAL OPPORTUNITY GRANTS
30633925,18429920184,2018,184299,4,84.033,FEDERAL WORK-STUDY PROGRAM,18111,Y,,,,,,Y,84,033,135648615,84,U,,,N,0,,0,,STUDENT FINANCIAL AID,N,,18111,2917407,,FEDERAL WORK-STUDY PROGRAM
29585121,18508520181,2018,185085,1,14.871,SECTION 8 HOUSING CHOICE VOUCHERS,1506989,Y,,,,,,Y,14,871,431517523,14,U,,,N,0,,0,,,N,,1506989,,,
29585122,18508520182,2018,185085,2,14.238,SHELTER PLUS CARE,68330,N,,,,,,Y,14,238,431517523,14,,,,N,0,,0,,,N,,68330,,,
29507310,18738220181,2018,187382,1,10.553,SCHOOL BREAKFAST PROGRAM,61664,N,,,,,,N,10,553,480725304,10,,,,N,0,,0,,CHILD NUTRITION CLUSTER,N,,61664,434804,,
29507862,187382201810,2018,187382,10,93.558,TEMPORARY ASSISTANCE FOR NEEDY FAMILIES,1740,N,,,,,,N,93,558,480725304,93,,,,N,0,,0,,,N,,1740,,,
29515468,187382201811,2018,187382,11,84.027,SPECIAL EDUCATION_GRANTS TO STATES,565341,Y,,,,,,N,84,027,480725304,84,U,,,N,1,,0,,SPECIAL EDUCATION CLUSTER (IDEA),N,,565341,579605,,
29507312,18738220182,2018,187382,2,10.555,NATIONAL SCHOOL LUNCH PROGRAM,371071,N,,,,,,N,10,555,480725304,10,,,,N,0,,0,,CHILD NUTRITION CLUSTER,N,,371071,434804,,
29507319,18738220183,2018,187382,3,10.556,SPECIAL MILK PROGRAM FOR CHILDREN,2069,N,,,,,,N,10,556,480725304,10,,,,N,0,,0,,CHILD NUTRITION CLUSTER,N,,2069,434804,,
29507342,18738220184,2018,187382,4,84.173,SPECIAL EDUCATION_PRESCHOOL GRANTS,14264,Y,,,,,,N,84,173,480725304,84,U,,,N,0,,0,,SPECIAL EDUCATION CLUSTER (IDEA),N,,14264,579605,,
29507345,18738220185,2018,187382,5,97.042,EMERGENCY MANAGEMENT PERFORMANCE GRANTS,18060,N,,,,,,N,97,042,480725304,97,,,,N,0,,0,,,N,,18060,,,
29507852,18738220186,2018,187382,6,84.010,TITLE I GRANTS TO LOCAL EDUCATIONAL AGENCIES,118936,N,,,,,,N,84,010,480725304,84,,,,N,0,,0,,,N,,118936,,,
29507856,18738220187,2018,187382,7,84.048,CAREER AND TECHNICAL EDUCATION -- BASIC GRANTS TO STATES,2707,N,,,,,,N,84,048,480725304,84,,,,N,0,,0,,,N,,2707,,,
