ELECAUDITSID,ID,AUDITYEAR,DBKEY,CFDASEQNUM,CFDA,FEDERALPROGRAMNAME,AMOUNT,MAJORPROGRAM,TYPEREQUIREMENT,QCOSTS2,FINDINGS,FINDINGREFNUMS,RD,DIRECT,CFDA_PREFIX,CFDA_EXT,EIN,CFDA2,TYPEREPORT_MP,TYPEREPORT_MP_OVERRIDE,ARRA,LOANS,FINDINGSCOUNT,LOANBALANCE,PASSTHROUGHAMOUNT,AWARDIDENTIFICATION,CLUSTERNAME,PASSTHROUGHAWARD,STATECLUSTERNAME,PROGRAMTOTAL,CLUSTERTOTAL,OTHERCLUSTERNAME,CFDAPROGRAMNAME
30219740,146632201883,2018,146632,83,10.699,PARTNERSHIP AGREEMENTS,9842,Y,,,,,,Y,10,699,726000720,10,Q,,,N,3,,0,,RESEARCH AND DEVELOPMENT,N,,9842,165625245,,
30220487,1466322018830,2018,146632,830,97.044,ASSISTANCE TO FIREFIGHTERS GRANT,611996,N,,,,,,Y,97,044,726000720,97,,,,N,0,,0,,,N,,611996,,,
30220488,1466322018831,2018,146632,831,97.045,COOPERATING TECHNICAL PARTNERS,356353,N,,,,,,Y,97,045,726000720,97,,,,N,0,,0,,,N,,356353,,,
30220489,1466322018832,2018,146632,832,97.047,PRE-DISASTER MITIGATION,637509,N,,,,,,Y,97,047,726000720,97,,,,N,0,,579069,,,Y,,637509,,,
30220490,1466322018833,2018,146632,833,97.056,PORT SECURITY GRANT PROGRAM,40170,N,,,,,,Y,97,056,726000720,97,,,,N,0,,0,,,N,,40170,,,
30220491,1466322018834,2018,146632,834,97.061,CENTERS FOR HOMELAND SECURITY,-301,N,,,,,,N,97,061,726000720,97,,,,N,0,,0,,,N,,200632,,,
30220492,1466322018835,2018,146632,835,97.067,HOMELAND SECURITY GRANT PROGRAM,3457953,N,,,,,,Y,97,067,726000720,97,,,,N,0,,2725805,,,Y,,3457953,,,
30220493,1466322018836,2018,146632,836,97.088,DISASTER ASSISTANCE PROJECTS,19348634,N,,,,,,Y,97,088,726000720,97,,,,N,0,,0,,,N,,19348634,,,
30220494,1466322018837,2018,146632,837,97.092,REPETITIVE FLOOD CLAIMS,464576,N,,,,,,Y,97,092,726000720,97,,,,N,0,,462958,,,Y,,464576,,,
30220495,1466322018838,2018,146632,838,97.107,NATIONAL INCIDENT MANAGEMENT SYSTEM (NIMS),963,N,,,,,,N,97,107,726000720,97,,,,N,0,,0,,,N,,963,,,
30220496,1466322018839,2018,146632,839,97.110,SEVERE REPETITIVE LOSS PROGRAM,-2077778,N,,,,,,Y,97,110,726000720,97,,,,N,0,,-2128529,,,Y,,-2077778,,,
30219741,146632201884,2018,146632,84,10.874,DELTA HEALTH CARE SERVICES GRANT PROGRAM,245910,Y,,,,,,Y,10,874,726000720,10,Q,,,N,3,,144644,,RESEARCH AND DEVELOPMENT,Y,,272491,165625245,,
30220497,1466322018840,2018,146632,840,97.127,CYBERSECURITY EDUCATION AND TRAINING ASSISTANCE PROGRAM (CETAP),277793,N,,,,,,N,97,127,726000720,97,,,,N,0,,0,,,N,,277793,,,
30220498,1466322018841,2018,146632,841,97.U01,DHS-OIG NON-DISASTER & DISASTER HOTLINE SERVICES,439463,N,,,,,,Y,97,U01,726000720,97,,,,N,0,,0,41663 HIG-70VT1518P00005,,N,,439463,,,
30220499,1466322018842,2018,146632,842,97.061,CENTERS FOR HOMELAND SECURITY,200933,Y,,,,,,N,97,061,726000720,97,Q,,,N,3,,0,,RESEARCH AND DEVELOPMENT,N,,200632,165625245,,
30220500,1466322018843,2018,146632,843,98.001,USAID FOREIGN ASSISTANCE FOR PROGRAMS OVERSEAS,566404,N,,,,,,N,98,001,726000720,98,,,,N,0,,0,,,N,,566404,,,
30220501,1466322018844,2018,146632,844,98.U01,FOOD AND ENTERPRISE DEVELOPMENT PROGRAM FOR LIBERIA (FED),-19357,N,,,,,,N,98,U01,726000720,98,,,,N,0,,0,1001609-11S-18847-00,,N,,-19357,,,
30220502,1466322018845,2018,146632,845,98.U02,BHEARD - BANGLADESH - MURSHIDA KHAN PHD PROGRAM,24354,N,,,,,,N,98,U02,726000720,98,,,,N,0,,0,RC102095-B2004,,N,,24354,,,
30220503,1466322018846,2018,146632,846,98.U03,BHEARD PROGRAM - GHANA: EXPRESSION OF INTEREST (BENNETT DZANDU),51942,N,,,,,,N,98,U03,726000720,98,,,,N,0,,0,RC102095-BHEARD-GHANA,,N,,51942,,,
30220504,1466322018847,2018,146632,847,98.U04,BHEARD PROGRAM - MALAWI: EXPRESSION OF INTEREST,57576,N,,,,,,N,98,U04,726000720,98,,,,N,0,,0,RC102095-BHEARD-MALAWI,,N,,57576,,,
30220505,1466322018848,2018,146632,848,98.U05,BHEARD PROGRAM - RWANDA: EXPRESSION OF INTEREST (MARIE DUTUZE),30521,N,,,,,,N,98,U05,726000720,98,,,,N,0,,0,RC102095-BHEARD-RWANDA,,N,,30521,,,
30220506,1466322018849,2018,146632,849,98.U06,BHEARD - GHANA - EMMANUEL KYEREH PHD PROGRAM,35765,N,,,,,,N,98,U06,726000720,98,,,,N,0,,0,RC102095-G2003,,N,,35765,,,
30219742,146632201885,2018,146632,85,10.890,RURAL DEVELOPMENT COOPERATIVE AGREEMENT PROGRAM,9098,Y,,,,,,N,10,890,726000720,10,Q,,,N,3,,0,,RESEARCH AND DEVELOPMENT,N,,5956,165625245,,
30219743,146632201886,2018,146632,86,10.902,SOIL AND WATER CONSERVATION,34016,Y,,,,,,Y,10,902,726000720,10,Q,,,N,3,,0,,RESEARCH AND DEVELOPMENT,N,,129916,165625245,,
30220507,1466322018850,2018,146632,850,98.U07,BHEARD - UGANDA - SARAH KAGOYA PHD PROGRAM,18706,N,,,,,,N,98,U07,726000720,98,,,,N,0,,0,RC102095-U1003,,N,,18706,,,
30220508,1466322018851,2018,146632,851,98.U08,SUPPORT TO AGRICULTURAL RESEARCH AND DEVELOPMENT PROGRAM,69117,N,,,,,,N,98,U08,726000720,98,,,,N,0,,0,UFDSP00011923,,N,,69117,,,
30220509,1466322018852,2018,146632,852,99.U01,LSU HOTLINE CALL CENTER,782,N,,,,,,Y,99,U01,726000720,99,,,,N,0,,0,AOC18P6032,,N,,782,,,
30219744,146632201887,2018,146632,87,10.912,ENVIRONMENTAL QUALITY INCENTIVES PROGRAM,639545,Y,,,,,,Y,10,912,726000720,10,Q,,,N,3,,0,,RESEARCH AND DEVELOPMENT,N,,1652266,165625245,,
30219745,146632201888,2018,146632,88,10.932,REGIONAL CONSERVATION PARTNERSHIP PROGRAM,4136,Y,,,,,,N,10,932,726000720,10,Q,,,N,3,,0,,RESEARCH AND DEVELOPMENT,N,,4136,165625245,,
30219746,146632201889,2018,146632,89,10.950,AGRICULTURAL STATISTICS REPORTS,4000,Y,,,,,,Y,10,950,726000720,10,Q,,,N,3,,0,,RESEARCH AND DEVELOPMENT,N,,4436,165625245,,
30219666,14663220189,2018,146632,9,10.170,SPECIALTY CROP BLOCK GRANT PROGRAM - FARM BILL,364061,N,,,,,,Y,10,170,726000720,10,,,,N,2,,0,,,N,,364061,,,
30219747,146632201890,2018,146632,90,10.RD,FY17 CSF PROFICIENCY TESTING,1500,Y,,,,,,Y,10,RD,726000720,10,Q,,,N,3,,0,AG-6197-P-17-0376,RESEARCH AND DEVELOPMENT,N,,217935,165625245,,
30219748,146632201891,2018,146632,91,10.RD,OPERATION OF UVB MONITORING SITE,2500,Y,,,,,,N,10,RD,726000720,10,Q,,,N,3,,0,CSU 1,RESEARCH AND DEVELOPMENT,N,,217935,165625245,,
30219749,146632201892,2018,146632,92,10.RD,CELLULOSIC NANOMATERIALS AS MULTIFUNCTIONAL ADDITIVES IN WATER-BASED DRILLING FLUIDS FOR OIL AND GAS INDUSTRY,91920,Y,,,,,,N,10,RD,726000720,10,Q,,,N,3,,38624,E17-23,RESEARCH AND DEVELOPMENT,Y,,217935,165625245,,
30219750,146632201893,2018,146632,93,10.RD,EXPLORING BENEFICIAL EFFECTS OF BLUEBERRIES IN HORSES,27668,Y,,,,,,N,10,RD,726000720,10,Q,,,N,3,,0,EBEBH,RESEARCH AND DEVELOPMENT,N,,217935,165625245,,
30219751,146632201894,2018,146632,94,10.RD,MAXIMIZING PREBIOTICS PRODUCTION FROM SORGHUM GRAIN,17176,Y,,,,,,N,10,RD,726000720,10,Q,,,N,3,,0,HVM12-16,RESEARCH AND DEVELOPMENT,N,,217935,165625245,,
30219752,146632201895,2018,146632,95,10.RD,DEVELOPING A COMPREHENSIVE MANAGEMENT PROGRAM FOR FOLIAR DISEASES OF SOYBEAN,-4911,Y,,,,,,N,10,RD,726000720,10,Q,,,N,3,,0,SIUC 15-14,RESEARCH AND DEVELOPMENT,N,,217935,165625245,,
30219753,146632201896,2018,146632,96,10.RD,DEVELOPING A COMPREHENSIVE MANAGEMENT PROGRAM FOR FOLIAR DISEASES OF SOYBEAN,-977,Y,,,,,,N,10,RD,726000720,10,Q,,,N,3,,0,SIUC 15-15,RESEARCH AND DEVELOPMENT,N,,217935,165625245,,
30219754,146632201897,2018,146632,97,10.553,SCHOOL BREAKFAST PROGRAM,87963944,N,,,,,,Y,10,553,726000720,10,,,,N,0,,87192451,,CHILD NUTRITION CLUSTER,Y,,87963944,373559802,,
30219755,146632201898,2018,146632,98,10.555,NATIONAL SCHOOL LUNCH PROGRAM,277360748,N,,,,,,Y,10,555,726000720,10,,,,N,0,,275726431,,CHILD NUTRITION CLUSTER,Y,,277360748,373559802,,
30219756,146632201899,2018,146632,99,10.556,SPECIAL MILK PROGRAM FOR CHILDREN,972,N,,,,,,Y,10,556,726000720,10,,,,N,0,,642,,CHILD NUTRITION CLUSTER,Y,,972,373559802,,
29744795,15265120181,2018,152651,1,10.553,SCHOOL BREAKFAST PROGRAM,174623,N,,,,,,N,10,553,646008815,10,,,,N,0,,0,,CHILD NUTRITION CLUSTER,N,,174623,729929,,
29744796,15265120182,2018,152651,2,10.555,NATIONAL SCHOOL LUNCH PROGRAM,555306,N,,,,,,N,10,555,646008815,10,,,,N,0,,0,,CHILD NUTRITION CLUSTER,N,,555306,729929,,
29744798,15265120183,2018,152651,3,84.010,TITLE I GRANTS TO LOCAL EDUCATIONAL AGENCIES,538212,Y,,,,,,N,84,010,646008815,84,U,,,N,0,,0,,,N,,538212,,,
29744799,15265120184,2018,152651,4,84.358,RURAL EDUCATION,31019,N,,,,,,N,84,358,646008815,84,,,,N,0,,0,,,N,,31019,,,
29744800,15265120185,2018,152651,5,84.367,IMPROVING TEACHER QUALITY STATE GRANTS,71750,N,,,,,,N,84,367,646008815,84,,,,N,0,,0,,,N,,71750,,,
29744801,15265120186,2018,152651,6,84.424,STUDENT SUPPORT AND ACADEMIC ENRICHMENT PROGRAM,2032,N,,,,,,N,84,424,646008815,84,,,,N,0,,0,,,N,,2032,,,
29744802,15265120187,2018,152651,7,84.027,SPECIAL EDUCATION_GRANTS TO STATES,229622,N,,,,,,N,84,027,646008815,84,,,,N,1,,0,,SPECIAL EDUCATION CLUSTER (IDEA),N,,229622,254020,,
29744803,15265120188,2018,152651,8,84.173,SPECIAL EDUCATION_PRESCHOOL GRANTS,24398,N,,,,,,N,84,173,646008815,84,,,,N,0,,0,,SPECIAL EDUCATION CLUSTER (IDEA),N,,24398,254020,,
29744804,15265120189,2018,152651,9,93.778,MEDICAL ASSISTANCE PROGRAM,9784,N,,,,,,N,93,778,646008815,93,,,,N,0,,0,,,N,,9784,,,
30382087,18185620181,2018,181856,1,14.191,MULTIFAMILY HOUSING SERVICE COORDINATORS,13720,N,,,,,,Y,14,191,742989751,14,,,,N,0,,0,SECTION 202,,N,,13720,,,
30382090,18185620182,2018,181856,2,14.871,SECTION 8 HOUSING CHOICE VOUCHERS,399491,N,,,,,,Y,14,871,742989751,14,,,,N,0,,0,SECTION 8,,N,,399491,,,
30382091,18185620183,2018,181856,3,14.155,MORTGAGE INSURANCE FOR THE PURCHASE OR REFINANCING OF EXISTING MULTIFAMILY HOUSING PROJECTS,1872409,Y,,,,,,Y,14,155,742989751,14,U,,,Y,1,1872409,0,SECTION 207,,N,,1872409,,,
29851836,19220820181,2018,192208,1,20.106,AIRPORT IMPROVEMENT PROGRAM,1807564,Y,,,,,,Y,20,106,751279194,20,U,,,N,0,,0,3-48-0064-113-16,,N,,39972242,,,
29851848,192208201813,2018,192208,13,16.738,EDWARD BYRNE MEMORIAL JUSTICE ASSISTANCE GRANT PROGRAM,52178,N,,,,,,Y,16,738,751279194,16,,,,N,0,,0,,,N,,52178,,,
29851845,192208201810,2018,192208,10,97.067,HOMELAND SECURITY GRANT PROGRAM,145300,N,,,,,,Y,97,067,751279194,97,,,,N,0,,0,3421201,,N,,267181,,,
29851846,192208201811,2018,192208,11,97.067,HOMELAND SECURITY GRANT PROGRAM,107682,N,,,,,,Y,97,067,751279194,97,,,,N,0,,0,3319801,,N,,267181,,,
29851847,192208201812,2018,192208,12,95.001,HIGH INTENSITY DRUG TRAFFICKING AREAS PROGRAM,124064,N,,,,,,Y,95,001,751279194,95,,,,N,0,,0,TX2203600,,N,,124064,,,
29851849,192208201814,2018,192208,14,21.000,TREASURY FORFEITURE FUND PROGRAM,16966,N,,,,,,Y,21,000,751279194,21,,,,N,0,,0,,,N,,16966,,,
29851837,19220820182,2018,192208,2,20.106,AIRPORT IMPROVEMENT PROGRAM,2033194,Y,,,,,,Y,20,106,751279194,20,U,,,N,0,,0,3-48-0064-114-16,,N,,39972242,,,
29851838,19220820183,2018,192208,3,20.106,AIRPORT IMPROVEMENT PROGRAM,250819,Y,,,,,,Y,20,106,751279194,20,U,,,N,0,,0,3-48-0064-115-16,,N,,39972242,,,
29851839,19220820184,2018,192208,4,20.106,AIRPORT IMPROVEMENT PROGRAM,29272491,Y,,,,,,Y,20,106,751279194,20,U,,,N,0,,0,3-48-0064-117-17,,N,,39972242,,,
29851840,19220820185,2018,192208,5,20.106,AIRPORT IMPROVEMENT PROGRAM,1267027,Y,,,,,,Y,20,106,751279194,20,U,,,N,0,,0,3-48-0064-118-17,,N,,39972242,,,
29851841,19220820186,2018,192208,6,20.106,AIRPORT IMPROVEMENT PROGRAM,5341147,Y,,,,,,Y,20,106,751279194,20,U,,,N,0,,0,3-48-0064-120-18,,N,,39972242,,,
29851842,19220820187,2018,192208,7,20.507,FEDERAL TRANSIT_FORMULA GRANTS,219415,N,,,,,,N,20,507,751279194,20,,,,N,0,,0,,FEDERAL TRANSIT CLUSTER,N,,219415,219415,,
29851843,19220820188,2018,192208,8,20.205,HIGHWAY PLANNING AND CONSTRUCTION,68011,N,,,,,,N,20,205,751279194,20,,,,N,0,,0,CSJ 0902-48-712,HIGHWAY PLANNING AND CONSTRUCTION CLUSTER,N,,68011,68011,,
29851844,19220820189,2018,192208,9,97.067,HOMELAND SECURITY GRANT PROGRAM,14199,N,,,,,,Y,97,067,751279194,97,,,,N,0,,0,3321501,,N,,267181,,,
30615101,19844120181,2018,198441,1,14.228,COMMUNITY DEVELOPMENT BLOCK GRANTS/STATE'S PROGRAM AND NON-ENTITLEMENT GRANTS IN HAWAII,305190,N,,,,,,N,14,228,660435312,14,,,,N,1,,0,,,N,,305190,0,,COMMUNITY DEVELOPMENT BLOCK GRANTS/STATE'S PROGRAM AND NON-ENTITLEMENT GRANTS IN HAWAII
30615135,198441201810,2018,198441,10,66.818,BROWNFIELDS ASSESSMENT AND CLEANUP COOPERATIVE AGREEMENTS,26668,N,,,,,,N,66,818,660435312,66,,,,N,1,,0,,,N,,26668,0,,BROWNFIELDS ASSESSMENT AND CLEANUP COOPERATIVE AGREEMENTS
30615188,198441201811,2018,198441,11,14.871,SECTION 8 HOUSING CHOICE VOUCHERS,848192,N,,,,,,Y,14,871,660435312,14,,,,N,2,,0,,,N,,848192,0,,SECTION 8 HOUSING CHOICE VOUCHERS
30615108,19844120182,2018,198441,2,14.231,EMERGENCY SOLUTIONS GRANT PROGRAM,8100,N,,,,,,N,14,231,660435312,14,,,,N,1,,0,,,N,,8100,0,,EMERGENCY SOLUTIONS GRANT PROGRAM
30615112,19844120183,2018,198441,3,10.558,CHILD AND ADULT CARE FOOD PROGRAM,16383,N,,,,,,N,10,558,660435312,10,,,,N,1,,0,,,N,,16383,0,,CHILD AND ADULT CARE FOOD PROGRAM
30615116,19844120184,2018,198441,4,10.433,RURAL HOUSING PRESERVATION GRANTS,1774,N,,,,,,N,10,433,660435312,10,,,,N,1,,0,,,N,,1774,0,,RURAL HOUSING PRESERVATION GRANTS
30615118,19844120185,2018,198441,5,16.575,CRIME VICTIM ASSISTANCE,41907,N,,,,,,N,16,575,660435312,16,,,,N,1,,0,,,N,,41907,0,,CRIME VICTIM ASSISTANCE
30615120,19844120186,2018,198441,6,20.513,ENHANCED MOBILITY OF SENIORS AND INDIVIDUALS WITH DISABILITIES,365427,N,,,,,,N,20,513,660435312,20,,,,N,1,,0,,,N,,365427,0,,ENHANCED MOBILITY OF SENIORS AND INDIVIDUALS WITH DISABILITIES
30615129,19844120187,2018,198441,7,93.045,"SPECIAL PROGRAMS FOR THE AGING_TITLE III, PART C_NUTRITION SERVICES",51519,N,,,,,,N,93,045,660435312,93,,,,N,1,,0,,,N,,51519,0,,"SPECIAL PROGRAMS FOR THE AGING_TITLE III, PART C_NUTRITION SERVICES"
30615131,19844120188,2018,198441,8,93.575,CHILD CARE AND DEVELOPMENT BLOCK GRANT,395119,N,,,,,,N,93,575,660435312,93,,,,N,1,,0,,,N,,395119,0,,CHILD CARE AND DEVELOPMENT BLOCK GRANT
30615133,19844120189,2018,198441,9,97.036,DISASTER GRANTS - PUBLIC ASSISTANCE (PRESIDENTIALLY DECLARED DISASTERS),2168276,Y,,,,,,N,97,036,660435312,97,U,,,N,1,,0,,,N,,2168276,0,,DISASTER GRANTS - PUBLIC ASSISTANCE (PRESIDENTIALLY DECLARED DISASTERS)
30317965,19847620181,2018,198476,1,14.181,SUPPORTIVE HOUSING FOR PERSONS WITH DISABILITIES,1290800,Y,,,,,,Y,14,181,954204895,14,U,,,Y,0,1290800,0,,,N,,1393901,,,
30317969,19847620182,2018,198476,2,14.181,PROJECT RENTAL ASSISTANCE CONTRACT (PRAC),103101,N,,,,,,Y,14,181,954204895,14,,,,N,0,,0,,,N,,1393901,,,
29353141,20473220181,2018,204732,1,10.767,INTERMEDIARY RELENDING PROGRAM,1307227,Y,,,,,,Y,10,767,561909969,10,U,,,Y,1,1123045,0,,,N,,1307227,,,
29049753,22479120181,2018,224791,1,14.182,SECTION 8 HOUSING ASSISTANCE PAYMENTS,668412,N,,,,,,Y,14,182,351986796,14,,,,N,0,,0,U##,,N,,668412,,,
29082020,22479120182,2018,224791,2,14.155,SECTION 223(F) LOAN BALANCE,2107085,Y,,,,,,Y,14,155,351986796,14,U,,,Y,0,2054003,0,U##,,N,,2107085,,,
29063019,22593320181,2018,225933,1,14.157,SUPPORTIVE HOUSING FOR THE ELDERLY,1452405,Y,,,,,,Y,14,157,840894901,14,U,,,Y,0,1452405,0,,,N,,1452405,,,
29063020,22593320182,2018,225933,2,14.182,SECTION 8 NEW CONSTRUCTION & SUBSTANTIAL REHABILITATION,216189,N,,,,,,Y,14,182,840894901,14,,,,N,0,,0,,HOUSING VOUCHER CLUSTER,N,,216189,216189,,
29063021,22593320183,2018,225933,3,14.228,COMMUNITY DEVELOPMENT BLOCK GRANTS/STATE'S PROGRAM AND NON-ENTITLEME...,484340,N,,,,,,N,14,228,840894901,14,,,,N,0,,0,,,N,,484340,,,
29720656,22597820181,2018,225978,1,93.048,SPECIAL PROGRAMS FOR THE AGING_TITLE IV_AND TITLE II_DISCRETIONARY PROJECTS,359847,N,,,,,,N,93,048,205272141,93,,,,N,0,,237008,,,Y,,359847,,,
29720658,22597820182,2018,225978,2,93.071,MEDICARE ENROLLMENT ASSISTANCE PROGRAM,609310,N,,,,,,N,93,071,205272141,93,,,,N,0,,206550,,,Y,,609310,,,
29720659,22597820183,2018,225978,3,93.324,STATE HEALTH INSURANCE ASSISTANCE PROGRAM,1422365,Y,,,,,,N,93,324,205272141,93,U,,,N,0,,863531,,,Y,,1422365,,,
29720661,22597820184,2018,225978,4,93.628,AFFORDABLE CARE ACT IMPLEMENTATION SUPPORT FOR STATE DEMONSTRATIONS TO INTEGRATE CARE FOR MEDICARE-MEDICAID ENROLLEES,194826,N,,,,,,N,93,628,205272141,93,,,,N,0,,160727,,,Y,,194826,,,
29386760,22957220181,2018,229572,1,84.010,TITLE I GRANTS TO LOCAL EDUCATIONAL AGENCIES,2764885,Y,,,,,,N,84,010,261607268,84,U,,,N,0,,0,,,N,,2764885,,,
29386890,229572201810,2018,229572,10,10.555,NATIONAL SCHOOL LUNCH PROGRAM,2494323,N,,,,,,N,10,555,261607268,10,,,,N,0,,0,,CHILD NUTRITION CLUSTER,N,,2494323,3294001,,
29386892,229572201811,2018,229572,11,10.557,"SPECIAL SUPPLEMENTAL NUTRITION PROGRAM FOR WOMEN, INFANTS, AND CHILD...",357927,N,,,,,,N,10,557,261607268,10,,,,N,0,,0,,CHILD NUTRITION CLUSTER,N,,357927,3294001,,
29386869,22957220182,2018,229572,2,84.367,IMPROVING TEACHER QUALITY STATE GRANTS,298664,N,,,,,,N,84,367,261607268,84,,,,N,0,,0,,,N,,523664,,,
29386872,22957220183,2018,229572,3,84.365,ENGLISH LANGUAGE ACQUISITION STATE GRANTS,164183,N,,,,,,N,84,365,261607268,84,,,,N,0,,0,,,N,,164183,,,
29386876,22957220184,2018,229572,4,84.282,CHARTER SCHOOLS,70568,N,,,,,,N,84,282,261607268,84,,,,N,0,,0,D,,N,,70568,,,
29386879,22957220185,2018,229572,5,84.027,SPECIAL EDUCATION_GRANTS TO STATES,1202601,N,,,,,,N,84,027,261607268,84,,,,N,0,,0,,,N,,1202601,,,
29386882,22957220186,2018,229572,6,84.282,CHARTER SCHOOLS,0,N,,,,,,N,84,282,261607268,84,,,,N,0,,0,,,N,,70568,,,
29386883,22957220187,2018,229572,7,84.367,IMPROVING TEACHER QUALITY STATE GRANTS,225000,N,,,,,,N,84,367,261607268,84,,,,N,0,,0,D,,N,,523664,,,
29386885,22957220188,2018,229572,8,10.553,SCHOOL BREAKFAST PROGRAM,0,N,,,,,,N,10,553,261607268,10,,,,N,0,,0,,CHILD NUTRITION CLUSTER,N,,441751,3294001,,
29386888,22957220189,2018,229572,9,10.553,SCHOOL BREAKFAST PROGRAM,441751,N,,,,,,N,10,553,261607268,10,,,,N,0,,0,,CHILD NUTRITION CLUSTER,N,,441751,3294001,,
29223147,23129120181,2018,231291,1,20.106,AIRPORT IMPROVEMENT PROGRAM,978913,Y,,,,,,Y,20,106,876000269,20,U,,,N,0,,0,,,N,,978913,,,
29692766,2580220181,2018,25802,1,14.218,COMMUNITY DEVELOPMENT BLOCK GRANTS/ENTITLEMENT GRANTS,54000,N,,,,,,N,14,218,231425035,14,,,,N,0,,0,,,N,,54000,,,
29692914,25802201810,2018,25802,10,84.133,NATIONAL INSTITUTE ON DISABILITY AND REHABILITATION RESEARCH,61239,N,,,,,,Y,84,133,231425035,84,,,,N,0,,0,,,N,,61239,,,
29692975,25802201811,2018,25802,11,97.024,EMERGENCY FOOD AND SHELTER NATIONAL BOARD PROGRAM,34685,N,,,,,,Y,97,024,231425035,97,,,,N,0,,0,,,N,,34685,,,
29692825,2580220182,2018,25802,2,14.267,CONTINUUM OF CARE PROGRAM,234778,N,,,,,,Y,14,267,231425035,14,,,,N,0,,0,,,N,,234778,,,
29692852,2580220183,2018,25802,3,93.104,COMPREHENSIVE COMMUNITY MENTAL HEALTH SERVICES FOR CHILDREN WITH SER...,28008,N,,,,,,N,93,104,231425035,93,,,,N,0,,0,,,N,,28008,,,
29692860,2580220184,2018,25802,4,93.150,PROJECTS FOR ASSISTANCE IN TRANSITION FROM HOMELESSNESS (PATH),34892,N,,,,,,N,93,150,231425035,93,,,,N,0,,0,,,N,,34892,,,
29692868,2580220185,2018,25802,5,93.243,SUBSTANCE ABUSE AND MENTAL HEALTH SERVICES_PROJECTS OF REGIONAL AND ...,442146,Y,,,,,,N,93,243,231425035,93,U,,,N,0,,0,,,N,,480402,,,
29692876,2580220186,2018,25802,6,93.243,SUBSTANCE ABUSE AND MENTAL HEALTH SERVICES_PROJECTS OF REGIONAL AND ...,38256,Y,,,,,,N,93,243,231425035,93,U,,,N,0,,0,,,N,,480402,,,
29692887,2580220187,2018,25802,7,93.667,SOCIAL SERVICES BLOCK GRANT,135333,N,,,,,,N,93,667,231425035,93,,,,N,0,,0,,,N,,135333,,,
29692897,2580220188,2018,25802,8,93.958,BLOCK GRANT FOR COMMUNITY MENTAL HEALTH SERVICES,144401,N,,,,,,N,93,958,231425035,93,,,,N,0,,0,,,N,,144401,,,
29692903,2580220189,2018,25802,9,84.126,REHABILITATION SERVICES_VOCATIONAL REHABILITATION GRANTS TO STATES,41543,N,,,,,,N,84,126,231425035,84,,,,N,0,,0,,,N,,41543,,,
30056354,23345920181,2018,233459,1,84.010,TITLE I GRANTS TO LOCAL EDUCATIONAL AGENCIES,384536,Y,,,,,,N,84,010,731106094,84,U,,,N,0,,0,,,N,,441447,,,
30056370,233459201810,2018,233459,10,10.550,USDA DONATED FOODS,26234,Y,,,,,,N,10,550,731106094,10,U,,,N,0,,0,,CHILD NUTRITION CLUSTER,N,,26234,445514,,
30056373,233459201811,2018,233459,11,84.358,RURAL EDUCATION,15453,N,,,,,,N,84,358,731106094,84,,,,N,0,,0,,,N,,15453,,,
30056357,23345920182,2018,233459,2,84.010,TITLE I GRANTS TO LOCAL EDUCATIONAL AGENCIES,37839,Y,,,,,,N,84,010,731106094,84,U,,,N,0,,0,,,N,,441447,,,
30056358,23345920183,2018,233459,3,84.010,TITLE I GRANTS TO LOCAL EDUCATIONAL AGENCIES,19072,Y,,,,,,N,84,010,731106094,84,U,,,N,0,,0,,,N,,441447,,,
30056360,23345920184,2018,233459,4,84.027,SPECIAL EDUCATION_GRANTS TO STATES,176746,N,,,,,,N,84,027,731106094,84,,,,N,0,,0,,SPECIAL EDUCATION CLUSTER (IDEA),N,,179598,181514,,
30056362,23345920185,2018,233459,5,84.027,SPECIAL EDUCATION_GRANTS TO STATES,2550,N,,,,,,N,84,027,731106094,84,,,,N,0,,0,,SPECIAL EDUCATION CLUSTER (IDEA),N,,179598,181514,,
30056363,23345920186,2018,233459,6,84.027,SPECIAL EDUCATION_GRANTS TO STATES,302,N,,,,,,N,84,027,731106094,84,,,,N,0,,0,,SPECIAL EDUCATION CLUSTER (IDEA),N,,179598,181514,,
30056365,23345920187,2018,233459,7,84.173,SPECIAL EDUCATION_PRESCHOOL GRANTS,1916,N,,,,,,N,84,173,731106094,84,,,,N,0,,0,,SPECIAL EDUCATION CLUSTER (IDEA),N,,1916,181514,,
30056367,23345920188,2018,233459,8,10.555,NATIONAL SCHOOL LUNCH PROGRAM,288171,Y,,,,,,N,10,555,731106094,10,U,,,N,0,,0,,CHILD NUTRITION CLUSTER,N,,288171,445514,,
30056369,23345920189,2018,233459,9,10.553,SCHOOL BREAKFAST PROGRAM,131109,Y,,,,,,N,10,553,731106094,10,U,,,N,0,,0,,CHILD NUTRITION CLUSTER,N,,131109,445514,,
30481213,23675420181,2018,236754,1,14.155,MORTGAGE INSURANCE FOR THE PURCHASE OR REFINANCING OF EXISTING MULTIFAMILY HOUSING PROJECTS,664103,Y,,,,,,Y,14,155,221849025,14,U,,,Y,0,-1,0,,,N,,664103,,,
30481217,23675420182,2018,236754,2,14.164,FLEXIBLE SUBSIDY LOAN,812793,Y,,,,,,Y,14,164,221849025,14,U,,,Y,0,-1,0,,,N,,812793,,,
30481221,23675420183,2018,236754,3,14.195,SECTION 8 HOUSING ASSISTANCE PAYMENTS PROGRAM,71511,N,,,,,,Y,14,195,221849025,14,,,,N,0,,0,,,N,,71511,,,
30624345,24721920181,2018,247219,1,94.006,AMERICORPS,361904,N,,,,,,N,94,006,880431016,94,,,,N,0,,0,,,N,,361904,0,,AMERICORPS
30624354,247219201810,2018,247219,10,15.243,YOUTH CONSERVATION OPPORTUNITIES ON PUBLIC LANDS,194827,N,,,,,,Y,15,243,880431016,15,,,,N,0,,0,,,N,,194827,0,,
30624355,247219201811,2018,247219,11,15.546,YOUTH CONSERVATION PROGRAM,631177,N,,,,,,Y,15,546,880431016,15,,,,N,0,,0,,,N,,631177,0,,YOUTH CONSERVATION PROGRAM
30624357,247219201812,2018,247219,12,15.608,FISH AND WILDLIFE MANAGEMENT ASSISTANCE,559264,N,,,,,,Y,15,608,880431016,15,,,,N,0,,0,,,N,,559264,0,,FISH AND WILDLIFE MANAGEMENT ASSISTANCE
30624359,247219201813,2018,247219,13,15.611,WILDLIFE RESTORATION AND BASIC HUNTER EDUCATION,72047,N,,,,,,N,15,611,880431016,15,,,,N,0,,0,,,N,,72047,0,,WILDLIFE RESTORATION AND BASIC HUNTER EDUCATION
30624361,247219201814,2018,247219,14,15.631,PARTNERS FOR FISH AND WILDLIFE,12798,N,,,,,,Y,15,631,880431016,15,,,,N,0,,0,,,N,,12798,0,,PARTNERS FOR FISH AND WILDLIFE
30624363,247219201815,2018,247219,15,15.657,ENDANGERED SPECIES CONSERVATION  RECOVERY IMPLEMENTATION FUNDS,45887,N,,,,,,Y,15,657,880431016,15,,,,N,0,,0,,,N,,45887,0,,ENDANGERED SPECIES CONSERVATION  RECOVERY IMPLEMENTATION FUNDS
30624364,247219201816,2018,247219,16,15.676,"YOUTH ENGAGEMENT, EDUCATION, AND EMPLOYMENT PROGRAMS",13051,N,,,,,,Y,15,676,880431016,15,,,,N,0,,0,,,N,,13051,0,,"YOUTH ENGAGEMENT, EDUCATION, AND EMPLOYMENT PROGRAMS"
30624374,247219201817,2018,247219,17,15.931,CONSERVATION ACTIVITIES BY YOUTH SERVICE ORGANIZATIONS,2289043,N,,,,,,Y,15,931,880431016,15,,,,N,0,,0,,,N,,2289043,0,,CONSERVATION ACTIVITIES BY YOUTH SERVICE ORGANIZATIONS
30624377,247219201818,2018,247219,18,15.944,NATURAL RESOURCE STEWARDSHIP,82464,N,,,,,,Y,15,944,880431016,15,,,,N,0,,0,,,N,,82464,0,,NATURAL RESOURCE STEWARDSHIP
30624380,247219201819,2018,247219,19,15.954,"NATIONAL PARK SERVICE CONSERVATION, PROTECTION, OUTREACH, AND EDUCATION",74010,N,,,,,,Y,15,954,880431016,15,,,,N,0,,0,,,N,,74010,0,,"NATIONAL PARK SERVICE CONSERVATION, PROTECTION, OUTREACH, AND EDUCATION"
30624346,24721920182,2018,247219,2,15.224,CULTURAL RESOURCE MANAGEMENT,253259,N,,,,,,Y,15,224,880431016,15,,,,N,0,,0,,,N,,253259,0,,CULTURAL RESOURCE MANAGEMENT
30624397,247219201820,2018,247219,20,20.219,RECREATIONAL TRAILS PROGRAM,370753,N,,,,,,N,20,219,880431016,20,,,,N,0,,0,,,N,,370753,0,,RECREATIONAL TRAILS PROGRAM
30624398,247219201821,2018,247219,21,10.664,COOPERATIVE FORESTRY ASSISTANCE,1268553,N,,,,,,Y,10,664,880431016,10,,,,N,0,,0,,,N,,1268553,0,,COOPERATIVE FORESTRY ASSISTANCE
30624347,24721920183,2018,247219,3,15.225,RECREATION RESOURCE MANAGEMENT,248156,N,,,,,,Y,15,225,880431016,15,,,,N,0,,0,,,N,,248156,0,,RECREATION RESOURCE MANAGEMENT
30624348,24721920184,2018,247219,4,15.231,"FISH, WILDLIFE AND PLANT CONSERVATION RESOURCE MANAGEMENT",3877957,Y,,,,,,Y,15,231,880431016,15,U,,,N,0,,0,,,N,,4055467,0,,"FISH, WILDLIFE AND PLANT CONSERVATION RESOURCE MANAGEMENT"
30624349,24721920185,2018,247219,5,15.231,"FISH, WILDLIFE AND PLANT CONSERVATION RESOURCE MANAGEMENT",177510,Y,,,,,,N,15,231,880431016,15,U,,,N,0,,0,,,N,,4055467,0,,"FISH, WILDLIFE AND PLANT CONSERVATION RESOURCE MANAGEMENT"
30624350,24721920186,2018,247219,6,15.233,FORESTS AND WOODLANDS RESOURCE MANAGEMENT,19193,N,,,,,,Y,15,233,880431016,15,,,,N,0,,0,,,N,,19193,0,,FORESTS AND WOODLANDS RESOURCE MANAGEMENT
30624351,24721920187,2018,247219,7,15.235,SOUTHERN NEVADA PUBLIC LAND MANAGEMENT,23215,N,,,,,,Y,15,235,880431016,15,,,,N,0,,0,,,N,,23215,0,,SOUTHERN NEVADA PUBLIC LAND MANAGEMENT
30624352,24721920188,2018,247219,8,15.237,RANGELAND RESOURCE MANAGEMENT,808790,N,,,,,,Y,15,237,880431016,15,,,,N,0,,0,,,N,,808790,0,,RANGELAND RESOURCE MANAGEMENT
30624353,24721920189,2018,247219,9,15.238,CHALLENGE COST SHARE,34747,N,,,,,,Y,15,238,880431016,15,,,,N,0,,0,,,N,,34747,0,,CHALLENGE COST SHARE
30281654,24820120181,2018,248201,1,14.195,SECTION 8 HOUSING ASSISTANCE PAYMENTS PROGRAM,946678,Y,,,,,,Y,14,195,465442862,14,U,,,N,0,,0,,,N,,946678,,,
30351920,6605820181,2018,66058,1,93.569,COMMUNITY SERVICES BLOCK GRANT,504939,N,,,,,,N,93,569,430828205,93,,,,N,0,,0,,,N,,504939,,,
30351929,66058201810,2018,66058,10,14.239,HOME INVESTMENT PARTNERSHIPS PROGRAM,46893,Y,,,,,,N,14,239,430828205,14,U,,,N,0,,0,,,N,,7457115,,,
30351930,66058201811,2018,66058,11,14.239,HOME INVESTMENT PARTNERSHIPS PROGRAM,7410222,Y,,,,,,N,14,239,430828205,14,U,,,Y,0,7410222,0,,,N,,7457115,,,
30351921,6605820182,2018,66058,2,93.568,LOW-INCOME HOME ENERGY ASSISTANCE,575937,N,,,,,,N,93,568,430828205,93,,,,N,0,,0,,,N,,700769,,,
30351922,6605820183,2018,66058,3,93.568,LOW-INCOME HOME ENERGY ASSISTANCE,124832,N,,,,,,N,93,568,430828205,93,,,,N,0,,0,,,N,,700769,,,
